ID	Number	Name	Canton	Longitude	Latitude	Population	SpeakerAge	SpeakerGender	SpeakerLanguageUse	SpeakerProficiency	FullName	DialectGroup	DateOfRecording	Investigators
Chevroux	1	Chevroux	Vaud	6.9069294	46.8883582	367	73	m	parlait le patois avec ses parents; n'a plus que rarement l'occasion de la pratique avec quelque vieux ou avec des Fribourgeois du voisinage.	Sujet médiocre; tendance à franciser la pronunciation; finales atones peu sûres	Chevroux	Franco-Provençal	1907-09-20	Jeanjaquet, Gauchat
Vaugondry	2	Vaugondry	Vaud	6.6362255	46.8467152	60	66	m	a appris le patois avec les gens du village; presque personne ne le parle	Les deux éléments de la a͜ò tendent à se fondre en aͦ̄. Après les nasales ã et ò̃, on perçoit fréquemment un ṅ, mais pas après è̃. Le t̮ est très voisin de k̮. Dans le aprler rapide, l̮ après consonne devient y̆̍ ou y, surtout dans le groupe bl̮.	Vaugondry	Franco-Provençal	1905-03-27	Jeanjaquet, Tappolet
LAuberson	3	L'Auberson	Vaud	6.4590043	46.8178516	799	64	m	ses parents parlaient patois entre eux et souvent avec lui; a beaucoup frequenté des viellards qui s'en servaient aussi; le patois n'est plus usité	Bien que le sujet passe pour être le meilleur connaisseur de l’ancien idiome local, il ne le possède qu’imparfaitement. Il a beaucoup de peine à trouver certains mots et ses réponses renferment bien des formes douteuses ou erronées. La prononciation est influencée par le français; les finales atones tombent dans le parler rapide. La palatalisation du k devant les voyelles palatales a un caractère peu stable; l̮ est bien conservée	L’Auberson	Franco-Provençal	1905-10-12	Jeanjaquet, Tappolet
Vallorbe	4	Vallorbe	Vaud	6.3796258	46.711414	3279	30	m	né à Vallorbe, y a parlé le patois jusqu’à l’âge de 30 ans et est revenu s’y fixer en 1875, après un séjour de 17 ans à Ballaigues et dans le canton de Neuchâtel. Emploie encore le patois à l’occasion avec des contemporains	Le sujet se remémore difficilement certaines formes et plusieurs de ses réponses sont suspectes. L’absence de diphtongues orales est peut-être due à l’influence de la prononciation française. L’l̮, bien conservée à l’état isolé, se réduit à y̆̍ dans les combinaisons bl̮, pl̮, etc.	Vallorbe	Franco-Provençal	1905-10-11	Jeanjaquet, Tappolet
LeSentier	5	Le Sentier	Vaud	6.2358557	46.6122131	2191	64	m	né au Sentier, y a toujours habité,sauf 4 ans passés au Brassus, où le patois est le même; ses parents lui parlaient patois	Vocalisme de notation difficile. Les diphtongues sont nombreuses et de caractère assez flottant. L’a  long prend un timbre vélaire. Le son noté ë̄ est un ḕ très ouvert, avec nuance de œ, surtout sensible après labiale. L’l̮ des groupes pl̮, ç̑l̮ est sourde; t̮, d̮ sont nettement palatalisés et voisins de k, g mouillés.	Le Sentier	Franco-Provençal	1905-10-05	Jeanjaquet, Tappolet
Longirod	6	Longirod	Vaud	6.2585316	46.4944282	300	74	m	né à Longirod; a parlé patois dans sa famille	Bon sujet, qui répond sans hésitation. L’ó provenant de a l diphtongue en œó ou prend un timbre particulier; -ė final masculin conserve parfois une nuance d’o.L’l̮ tend à se simplifier en y.	Longirod	Franco-Provençal	1905-03-31	Jeanjaquet, Tappolet
Commugny	7	Commugny	Vaud	6.176213	46.320929	308	76	m	a toujours vécu à Commugny et y est un des derniers représentants du patois, qu'il a parlé dans sa famille	Une torte surdité rend l’interrogatoire difficile et pénible, et ne permet pas toujours de faire répéter des formes restées douteuses à la première audition.	Commugny	Franco-Provençal	1905-04-01	Jeanjaquet, Tappolet
Vullierens	8	Vullierens	Vaud	6.4816044	46.5727052	514	70	m	a toujours habité Vullierens; ses parents parlaient patois entre eux, mais français avec leurs enfants.	Les réponses de M.Henry sont parfois peu sûres. Les dents lui font défaut. Les voyelles finales sont peu distinctes; -ė après palatale disparait presque complètement dans le parler courant. Le sujet ne sent pas de difference entre les finales masculine et féminine de «rouge», tandis que Mme. B. distingue (cf. col. 248 et 395, où la remarque est à supprimer; voir aussi col. 285 et 289). r est linguale, souvent roulée; Mme. B. posséde encore l̮, réduite à y chez H. La résonance vélaire est fréquente après les voyelles nasales.	Vullierens	Franco-Provençal	1905-03-29	Jeanjaquet, Tappolet
Arnex	9	Arnex	Vaud	6.5189028	46.6980681	602	69	m	né à Arnex. On parlait patois et français dans sa famille, Jusque vers 1865, le patois était la langue habituelle du village.	Le second élément des diphtongues āė, āȯ est très peu sensible et peut disparaître en pause. Voyelles nasales généralement suivies de résonance vélaire; è̃ fortement accentué devient è̃ĩṅ; l̮ toujours réduite à y.	Arnex	Franco-Provençal	1905-03-28	Jeanjaquet, Tappolet
VillarsleTerroir	10	Villars-le-Terroir	Vaud	6.639461	46.657569	581	72	m	est né et a toujours vecu dans la localité; la langue de sa famille était le patois	Sujet possédant bien l’idiome local; un peu dur d’oreille; les dents manquent. Les finales atones -o et -e sont plutôt fermées; l̮ conservée, mais avec tendance à y, surtout dans la prononciation rapide des groupes pl̮, bl̮.	Villars-le-Terroir	Franco-Provençal	1905-03-30	Jeanjaquet, Tappolet
Prahins	11	Prahins	Vaud	6.7383916	46.7331778	175	80	m	né à Prahins, y a parlé patois dans sa famille; aujourd’hui, quelques vieillards seuls connaissent encore le dialecte local.	Prononciation pas très distincte; les dents supérieures manquent. Influence du français sensible dans plusieurs formes. Les anciennes diphtongues provenant de e et o latins sont généralèment fusionnées en aͤ̄, ṑ. Les finales atones ė, ò tendent à se fermer; l̮ des groupes pl̮, bl̮ se réduit à y dans le parler rapide.	Prahins	Franco-Provençal	1905-10-09	Jeanjaquet, Tappolet
Montpreveyres	12	Montpreveyres	Vaud	6.742199	46.582048	270	70	m	né à Montpreveyres. Ses parents lui parlaient patois; il le parle encore avec sa femme, de 9 ans plus jeune que lui, qui a assisté à une partie de l’interrogatoire et a fourni quelques variantes de prononciation.	Les diphtongues provenant de e et o latins oscillent, suivant la position dans le mot ou la phiase, l'intensité et la rapidité de l’articulation, entre aè-aͤ̄, aò-aͦ̄ (liées) et āė-ā, āȯ-ā́ (en pause); ā accentué dans le corps du mot est suivi de ṅ; ò̃ tend à ò̄ũ, è̄ĩ à aè̃ sous l’influence de l’accent; la nasalisation de è̃ est faible et disparaît chez Mme. L., qui prononce è̄; l̮ est réduite en combinaison avec d’autres consonnes; Mme. L. n’emploie plus que y.	Montpreveyres	Franco-Provençal	1905-10-08	Jeanjaquet, Tappolet
Charnex	13	Charnex	Vaud	6.91008	46.44591	425	72	m	né dans la localité, y a toujours pratiqué le patois	Vocalisme caractérisé par beaucoup de nuances intermédiaires et une tendance marquée à la refraction, notamment des nasales. Diphtongue provenant de o latin difficile à noter exactement; le premier élément est un aͤ avec nuance de œ plus ou moins sensible, le second un ȯ très fermé (T.note ꭒ); les deux sont brefs. La consonne issue de s t ou c + voy. palat. est une forte aspiration très voisine de c̑ ou, dans d’autres cas, de ṣ; le premier élément de ts, dz s’affaiblit parfois; r finale peut n’ètre plus perçue, bien que le sujet ait toujours le sentiment de la prononcer; bl̮ tend à by.	Charnex (ou Chernex)	Franco-Provençal	1905-10-07	Jeanjaquet, Tappolet
Roche	14	Roche	Vaud	6.9290939	46.3614134	528	71	m	né à Roche, comme ses parents, qui lui parlaient patois	L’o latin aboutit à une diphtongue oœ̄, dont le premier élément est généralement réduit et peut disparaître; la prononciation de à̃ tend vers ėā, celle de ò̃ vers œ̇ò̃, mais de façon moins sensible qu'à Charnex (nº 13), les finales atones e, o sont souvent presque fermées. Quelques cas d’affaiblissement de dz en dz; l̮ bien conseivée aussi dans les groupes.	Roche	Franco-Provençal	1905-10-07	Jeanjaquet, Tappolet
OrmontDessus	15	Ormont-Dessus	Vaud	7.158066	46.3514789	78	66	f	née au Plan, de famille où on parlait patois	Les diphtongues āè, āȯ deviennent facilement aͤ̄, ṑ, surtout en proclise; è̄ perd sa nasalisation dans le parler rapide, en prenant un timbre plus fermé; -ė et -ȯ peuvent se confondre en finale atone. Le premier élément de ts, dz se réduit souvent et peut disparaître entièrement; tc̵  et dj sont généralement tc̵̾, dj͛; entre tc̨̑ et tc̵ , dy et dj existent des nuances intermédiaires difficilement analysables; l̮ entre voyelles est très voisine de r et a été notée parfois r̍; l̮ et ses combinaisons se présentent sous forme de consonnes de caractère complexe, spéciales à ce patois; l’impression acoustique variable rend la notation difficile; nos graphies compliquées ont été ramenées aux types suivants: le produit de cl, fl, aussi de c + yod, parfois de c + e, i, est un mélange de c̑, l et ṣ où prédomine plutôt le c̨̑ (noté uniformément ṣ̍; c̨̑ṣ̍ saurait été préférable); dans les résultats de pl, bl, la labiale est suivie d’une combinaison de I avec ṣ ou ẓ (noté pṣ̍, bẓ̍); enfin le produit de l̮ simple a été perçu comme une l vélaire accompagnée d’une légère nuance de ẓ (noté l̷, rarement ẓ̍). Cf. Mots supplémentaires § 38.	Ormont-Dessus	Franco-Provençal	1905-10-05/06	Jeanjaquet, Tappolet
ChateaudOex	16	Château-d'Oex	Vaud	7.1285556	46.4732964	3025	69	m	né à Chàteau-d’Oex; bien que ses parents aient plutôt parlé français avec leurs enfants, il a beaucoup pratiqué le patois, que sa femme connaît également	Le sujet répond sans hésitation et prononce distinctement; dz tend à se réduire à z; tc̨̑ devient fréquemment tc̵̨̑; ̣̣ṣ provenant de st peut passer à h.	Château-d'Oex	Franco-Provençal	1905-10-04	Jeanjaquet, Tappolet
StGingolph	17	St-Gingolph	Valais	6.8047071	46.3931549	660	56	f	née à Saint-Gingolph suisse, y a toujours vécu; parle quelque fois patois avec son mari	Le dialecte subit fortement l'influence du français, qui est la langue courante. La diphtongue notée ȧꭒ a pour premier élément un a teinté de œ et devient plutôt òu en proclise. Les finales atones sont très réduites; au lieu de -ė, on perçoit souvent un a légèrement nasalisé. L’articulation initiale de ts, dz est très faible, la résonance ṅ après les nasales très peu sensible, r intervocale réduite.	St-Gingolph	Franco-Provençal	1905-08-10	Jeanjaquet, Gauchat
Collombey	18	Collombey	Valais	6.9459222	46.2679563	564	76	m	a toujours vécu à Collombey, sauf, dans sa jeunesse, 3 ans passés à Saint-Maurice et 6 ans à Vernayaz; a été le premier, dans la localité, à parler français à ses enfants; le patois est maintenant en voie de disparition	Oscillations de la prononciation constatées entre h et d, â etè, éiete, Cièeth. Par suite du manque de dents,  ilestdifficiled’appréciei*exactementledegréd’épaississementdes,r;psdeplpeutpasseràp?oubzdansleparlerrapide.	Collombey	Franco-Provençal	1905-08-09	Jeanjaquet, Gauchat
Champery	19	Champéry	Valais	6.8693248	46.1778839	704	72	m	né à Champéry; ses parents exigeaient qu’il leur parlât français, mais, en dehors de la famille, et même avec ses frères et sœurs, il employait couramment le patois	Prononciation bien distincte. Différence très marquée entre a palatal (à → aͤ) et a vélaire (á → aͦ); la diphtongue provenant de i latin consiste en un œ articulé très en arrière et flottant plus ou moins vers é ou ô, combiné avec un i peu sensible; cf. Mots suppléinentaires § 21; in donne une diphtongue nasale á̃è̃, dont le premier élément tend vers aͦ̃ et le second vers œ̀̃. L’épaississement de s, z est insignifiant; r entre voyelles n’a qu’un battement lingual et se rapproche parfois de d.	Champéry	Franco-Provençal	1905-08-08	Jeanjaquet, Gauchat
Martigny	20	Martigny	Valais	7.073483	46.101706	1167	37	m	né à la Fontaine, hameau sur la route de la Forclaz; a travaillé plusieurs saisons comme employé dans les hôtels de la région; parle habituellement patois avec sa femme, français avec ses enfants.	La diphtongue œ̀u se simplifie fréquemment en œ moyen.	Martigny-Combe	Franco-Provençal	1905-07-30	Jeanjaquet, Gauchat
Orsieres	21	Orsières	Valais	7.1463639	46.0308094	2215	30	m	né à Orsières; élevé dans un milieu patois, bien que ses parents lui aient parlé français; a fait ses classes à Marligny	Voyelles atones peu distinctes, avec articulation reculée et tendance vers un ė neutre. Même ă tonique se rapproche de œ̀ après labiale: bȧ «bat».	Orsières	Franco-Provençal	1905-08-06	Jeanjaquet, Gauchat
Lourtier	22	Lourtier	Valais	7.265844	46.049002	232	21	m	a toujours vécu à Lourtier	Prononciation peu nette. Beaucoup de sons intermédiaires: ȯ, ë, uͥ, etc. l̮ est  en train de devenir l; c̨̑l conserve parfois un reste de mouillure; deux r très différentes: ṛ linguale, souvent réduite à un seul battement, et ṙ uvulaire grasseyée. Les nombreuses notations contradictoires de J. et G., relevées dans les Tableaux, proviennent d'une erreur de graphie de G., qui a interverti l'emploi des deux signes pour r, ainsi qu'il résulte de ses notes.	Lourtier	Franco-Provençal	1905-07-31	Jeanjaquet, Gauchat
Fully	23	Fully	Valais	7.1147534	46.1385798	1494	26	m	né à Fully de parenis de l’endroit; a fréquenté l’École normale de Sion et a été instituleur pendant 4ans; se sert toujours du patois dans les relations journalières	Plusieurs voyelles mixtes d ecaractère variable et peu précis: ë, ò, uͨ, avec articulation reculée; diphtongue instable aė - aͤė - aͤi; œ̀u tend vers òꭒ, surtout en finale; les finales atones --è, -ò ne se distinguent pas toujours de -ė. A côté de r linguale existe ṙ uvulaire à l’initiale du mot ou comme produit d’anciennes combinaisons intérieures (-rr-, -cr-, -gr-, -tr-), voir Mots supplémeiilaives § 43; l̮ a fait place à y.	Fully	Franco-Provençal	1905-08-07	Jeanjaquet, Gauchat
Conthey	24	Conthey	Valais	7.3083227	46.2334191	381	34	m	né à Erde; a enseigné 9 ans à la Place, tout en conservant son domicile à Erde; habite depuis 3 ans à Plan-Conthey; parle habituellement le patois avec les gens de la commune; dans presque toutes les familles on parle maintenant français aux enfants	La diphtongue œ̀u oscille entre ce son et œ́; eͥ est une voyelle à articulation reculée, dont l’impression acoustique varie entre e et i ou é et œ̇; -ȯ final nettement distinct de -ė. Élément initial de ts, dz un peu affaibli; l tombée laisse parfois un reste d’articulation; nuance particulière de y intervocal qui tend à s’effacer en prenant un caractère interdental (G. note ė le son réduit; cf. col. 52, 183, etc.), voir Mots supplémentaires § 45. Influencé par son séjour dans la région inférieure de la commune, le sujet ne connait plus la déclinaison de l’article, qui est sans cela de règle dans les hameaux supérieurs.	Conthey	Franco-Provençal	1905-08-24	Jeanjaquet, Gauchat
Nendaz	25	Nendaz	Valais	7.3047431	46.1855093	567	38	m	né à Haute-Nendaz de parents de la même localité; a toujours pratiqué le patois, qui est la langue habituelle du village	La diphtongue œͦꭒͧ  varie plus ou moins entre òꭒ et œ̀u; dans ꭒͧ  le caractère prédominant est tantôt ꭒ, tantôt u; l’articulation est reculée, de même que dans ė̃; les ĕ̀ ont généralement une nuance de ė et se rapprochent parfois de a. l provenant de l mouillée est longue; c̨̑l de cl fait l’impression d’un son unique avec nuance de ṣ.	Nendaz	Franco-Provençal	1905-08-25	Jeanjaquet, Gauchat
Saviese	26	Savièse	Valais	7.3509003	46.2535376	2259	25	m	né au hameau d’Ormona, employé depuis 4 ans à l’Office des poursuites, à Sion: a parlé le patois dès son enfance et l'emploie journellement	L’l disparaît en laissant un reste d’articulation, que nous avons noté, faute de mieux, par o; il a le caractère d’une semi-voyelle voisine de w. cf. Mots supplémentaires § 44.	Savièse	Franco-Provençal	1905-08-22/24/26	Jeanjaquet, Gauchat
Ayent	27	Ayent	Valais	7.4081901	46.2771888	1450	47	m	né au hameau de Fortuno de parents d’Ayent; n’a jamais quitté la localité et parle toujours patois	Le son ꭒͧ  fait plutôt l’impression d'un u que d’un ꭒ; hesitations entre oͮ et ꭒ; ó̃ et ꭒ̃; ė̃ a une tendance marquee vers è̃; les finales atones –e et –o sont parfois nettement fermées. Degrés intermédiaires variables entre tc̵ et tc̨̑, dj et dy, sy et c̨̑; dz est généralement réduit à z, mais il peut y avoir des restes de d; h est très voisin de c̑; l̮ est en train de passer à l, en conservant souvent des restes de palatalisation.	Ayent	Franco-Provençal	1905-08-06	Jeanjaquet, Gauchat
Miege	28	Miège	Valais	7.5473871	46.3119557	438	40	m	né à Miège de parents de la localité; le patois est sa langue habituelle	Prononciation très nette. Les combinaisons tc̵̾c̨̑, dj͛y se rapprochent beaucoup de tc̨̑, dy; l̮ des groupes cl, fl, etc. a passé à l et ne conserve que rarement un léger reste de palatalization.	Miège	Franco-Provençal	1905-08-27	Jeanjaquet, Gauchat
Grone	29	Grône	Valais	7.4580917	46.2508508	741	37	m	né à Grône, comme son père; sa mère était de Grimisuat; a toujours pratiqué couramment le patois	La distinction entre oͮ et ꭒ est incertaine. Voyelles finales atones peu nettes dans le parler rapide; -è devient plus ou moins -ė, -ȯ est aussi nuance de -ė, -a peut se perdre; la nasalization est flottante et incomplete devant n + cons. Les sons complexes tc̵̾c̨̑, dj͛y, c̵̾c̨̑ tendent vers tc̨̑, dy, c̨̑; à l’intérieur du mot, le movement des organs qui produit le k «parasite» n’est qu’ébauchié; en finale, après e, i, k se palatalize légèrement.	Grône	Franco-Provençal	1905-08-23	Jeanjaquet, Gauchat
Evolene	30	Évolène	Valais	7.4963134	46.1125593	1208	42	m	né à Évolène; y a toujours parlé le patois, qui est seul employé dans toutes les familles	a est  toujours plus ou moins ȧ; tous les ḕ tendent vers ė, surtout en syllable atone et dans le parler rapide; il est un U en train de passer à u et don’t le caractère (Vu s’accentue si on fait prononcer distinctement; /, è, i, à sont des variations d’audition de voyelle imprecise à articulation reculée. Les finales atones sont faibles. Le k “parasite” n’est fortement articulé qu’en finale à la pause; à l’intérieur du mot ou en proclise, il s’affaiblit en k, g ou devient un simple commencement d’articulation; la vélaire nasale est bien marquée dans iṅ, venant de īn, moins dans ꭒṅ; n latine appuyée se conserve, sans nasalization de la voyelle précédente, en finale accentuée; dans d’autres conditions,ily a passage plus ou moins complet à la nasalization avec chute de l’n; cf. Mots supplémentaires § 42; v et y entre voyelles sont réduits; -d- passe facilement à ẓ.	Évolène	Franco-Provençal	1905-08-30/31	Jeanjaquet, Gauchat
Grimentz	31	Grimentz	Valais	7.5763635	46.1801158	249	56	m	né à Grimentz de parents de l’endroit; a toujours parlé le patois, qui est la seule langue employée par jeunes et vieux	Distinction entre ꭒ̃ et ꭒṅ difficile à faire; articulation vélaire plus sensible dans iṅ; la nasalization provenant d’n appuyée est absente ou partielle connu comme à Évolène; mêmes observations que dans cette localité au sujet du k «parasite»; ėi, ȯu avec articulation reculée alternant parfois avec ig et ꭒg; à l̮ correspond une l fortement vélaire a`l’état isolé, beaucoup plus faiblement dans les groupes pl̷, bl̷, etc.; h des combinaisons hr, hl a une nuance de ṣ. 	Grimentz	Franco-Provençal	1905-08-28	Jeanjaquet, Gauchat
Collex	32	Collex	Genève	6.1235296	46.2761547	92	77	m	a passé 7 ans à Crans et à la Rippe (Vaud), mais a bien conservé son patois, qui était la langue de sa famille; habite depuis peu chez des parents, à Genève, où a été fait le relevé	a latin tonique libre aboutit à un o diphtongué, de nature assez flottante; o nasal est généralement fermé, mais le degré varie; ŏ̀ est teinté de œ̀.	Collex	Franco-Provençal	1905-04-03	Jeanjaquet, Tappolet
Vernier	33	Vernier	Genève	6.084291	46.217026	1280	64	m	né à Vernier de parents de la localité; famille patoisante	a latin tonique libre donne une combinaison aͦ͜ó, dont les éléments peuvent varier de timbre et d’intensité; si le son est long, il se rapproche de ṑ; ó et é fortement accentués deviennent légèrement  óꭒ, éi; o nasal est à peine plus fermé qu’en français; finales atones encore distinctes: -a conservé, -ò intermédiaire entre -ò et -è, -è tendant vers -ė. l̮ très peu mouillée, la palatalization s’entend à peine dans le parler rapide, bien que le sujet ait toujours le sentiment de prononcer l̮.	Vernier	Franco-Provençal	1905-04-06	Jeanjaquet, Tappolet
Laconnex	34	Laconnex	Genève	6.0355571	46.1557721	247	82	m	a toujours habité Laconnex et parlé patois; le preatique encore avec sa femme, 78ans, aussi de Laconnex, qui assiste à l’interrogatoire	a latin tonique libre about it à un son voisin de ṑ, avec tendance à la diphtongaison en finale; ŏ̀ devient généralement œͦ̄ ou même œ̇; la nasalization de è̃ est faible et peut disparaître entièrement; -a final atone a une nuance particulière, intermédiaire entre –a, -ò, et -ė; l’impression varie un peu suivant la nature du son qui précède; les autres finales atones sont très réduites, tendent vers -ė et disparaissent souvent.	Laconnex	Franco-Provençal	1905-04-05	Jeanjaquet, Tappolet
Veyrier	35	Veyrier	Genève	6.1832454	46.16778	780	57	m	né à Veyrier, où il a parlé patois avec sa grand’mère et d’autres parents; ses réponses sont contrôlées et parfois rectifiées par M. François Portier, 92 ans, qui a toujours vécu à Veyrier et y a constamment pratiqué le patois	La pronunciation de Berthoud parait influence par le français; il laisse souvent tomber les finales atones, bien conserves chez Portier; -ò est intermédiaire entre -ȯ et -ė, -è tend vers -ė; ŏ̀ tonique est nuance de œ̇; a tonique libre aboutit à aͦ͜ȯ en finale; prolongé, il devient à peu près ṑ ou aṑ.	Veyrier	Franco-Provençal	1905-04-06	Jeanjaquet, Tappolet
Hermance	36	Hermance	Genève	6.244375	46.302258	362	64	f	n’a jamais quitté la commune et connait bien le patois, quelle a parlé dans sa famille; quelques personnes seulement l’emploient encore	Prononciation très distincte; ŏ̀ est souvent nuance de œ̇; ó fortement articulé deviant óu en finale; o nasal est fermé et peut aller jusqu’à ꭒ̀̃ à la fin du mot; ã provenant de on latin est légèrement á̃; finales atones assez distinctes: -a est un peu -à, -ò devient -ȯ, passe à -ė ou tombe dans le parler rapide.	Hermance	Franco-Provençal	1905-04-07	Jeanjaquet, Tappolet
Semsalves	37	Semsalves	Fribourg	6.9273567	46.5731935	909	46	m	parle couramment le patois	Prononciation claire, mais un peu francisée; dz tend à se réduire à z.	Semsalves	Franco-Provençal	1905-03-21	Jeanjaquet, Gauchat
Montbovon	38	Montbovon	Fribourg	7.0442231	46.4882147	611	63	m	sa femme, 59 ans, a fourni quelques variantes de prononciation	Les diphtongues òu, ėi peuvent passer en proclise à ꭒ, i, mais le fait n’est constant que dans des mots comme «du, des », etc. M. Comba prononce l’a long plutôt ā́, sa femme aͦ̄; è̃ est voisin de ã. Les sons épaissis c̵̾, j͛ pour s, z tendent à se confondre avec c̵, j; dans tc̵ī, djī, on perçoit fréquemment un faible y avant ī. v intervocal est très faiblement articulé; M. Comba conserve généralement l̮ partout, avec tendance à reduction à l dans c̨̑l̮, l̮ ė «il est», l̮ «il a», tandis que Mme. prononce pc̨̑, by pour pl̮, bl̮, c̨̑y pour c̨̑l̮.	Montbovon	Franco-Provençal	1905-03-20	Jeanjaquet, Gauchat
Arconciel	39	Arconciel	Fribourg	7.1214922	46.7473353	392	40	m	né à Arconciel de famille patoisante, parle habituellement le patois; a passé une année et demie à l’École normale de Hauterive	aͦ̄ de a long est souvent presque ṑ; á de l’ancienne diphtongue ei est moins ouvert qu’en Gruyère et se ferme un peu dans le parler rapide. l̮ est en train de passer à y; comme équivalent du pronom «il» devant voyelle, on entend tantôt l̮, tantôt l.	Arconciel	Franco-Provençal	1905-09-21	Jeanjaquet, Gauchat
AvrysurMatran	40	Avry-sur-Matran	Fribourg	7.0698887	46.7895993	409	49	f	née à Avry, où elle a toujours vécu jusqu’en 1895; habite depuis cette date le village de Matran, dislant de 2km	a long correspondant à a latin a une nuance vélaire prononcée (ā́), qui est moins sensible dans l’a issu de l’ancienne diphtongue āė et manque dans l’a provenant de la diphtongue āȯ. L’épaississement de s, z est peu marqué; l̮ des groups bl̮, etc. est en voie de devenir y.	Avry-sur-Matran	Franco-Provençal	1905-07-08	Jeanjaquet, Gauchat
