ID,Language_ID,Primary_Text,Analyzed_Word,Gloss,Translated_Text,Meta_Language_ID,Comment
1-Martigny,Martigny,fi tso vwe̞i͉,,,Il fait chaud aujourd‘hui,,
1-Dompierre,Dompierre,jə fa̠ː tso vwɛ,,,Il fait chaud aujourd‘hui,,
1-Charnex,Charnex,ĭ fɑ̝ː tsoː wĕ̞,,,Il fait chaud aujourd‘hui,,
1-Roche,Roche,ĭ fɑ̝ː tso wɑ̆ɛ͉,,,Il fait chaud aujourd‘hui,,
1-CerneuxPequignot,CerneuxPequignot,i fa̠ː bĩ tʃo ɔ̆d͉ʒdø̞,,,Il fait chaud aujourd‘hui,,
1-Savagnier,Savagnier,ɛ fa̠ː bæː tʃo vwĭ,,,Il fait chaud aujourd‘hui,,
1-Longirod,Longirod,ei͉ fɑː tsoː wi,,,Il fait chaud aujourd‘hui,,
1-Sugiez,Sugiez,jə fa̠ː tsŏ wə,,,Il fait chaud aujourd‘hui,,
1-Landeron,Landeron,e̞ fa̠ tʃou͉ wĭ,,,Il fait chaud aujourd‘hui,,
1-Arnex,Arnex,fa̠ː tso vwĭ,,,Il fait chaud aujourd‘hui,,
1-Vullierens,Vullierens,jə fɑː tsoː v͉wɑ̆,,,Il fait chaud aujourd‘hui,,
1-Veyrier,Veyrier,ĭ fă̠o θo wa̠͜e,,,Il fait chaud aujourd‘hui,,
1-OrmontDessus,OrmontDessus,jɛ fa̠ː tsoː wɛː,,,Il fait chaud aujourd‘hui,,
1-Montalchez,Montalchez,ɛ̆ fa̠ː tsoː v͉wĭ,,,Il fait chaud aujourd‘hui,,
1-Montpreveyres,Montpreveyres,jə fa̠ː tsŏ wa̠ː,,,Il fait chaud aujourd‘hui,,
1-Lourtier,Lourtier,ë fi tso wă̠,,,Il fait chaud aujourd‘hui,,
1-Ayent,Ayent,fei͉ tsŏ̞ wei͉,,,Il fait chaud aujourd‘hui,,
1-Cerlatez,Cerlatez,ɛ fæː tʃa̠ː ɑ̆dʒdœ̆,,,Il fait chaud aujourd‘hui,,
1-Corcelles,Corcelles,ɛ fa̠ː tʃo wĭ,,,Il fait chaud aujourd‘hui,,
1-Sombeval,Sombeval,a̠ fɛː tʃɑ̝ː ɔkh͉ø̞y͉,,,Il fait chaud aujourd‘hui,,
1-Vernier,Vernier,i fa̠͜o θo wă̠͜ɛ͉,,,Il fait chaud aujourd‘hui,,
1-StGingolph,StGingolph,foː tsʊ v͉wɛ̆i͉,,,Il fait chaud aujourd‘hui,,
1-Prahins,Prahins,jə fa̠ː tso wə,,,Il fait chaud aujourd‘hui,,
1-Plagne,Plagne,a̠ fɛː tʃɔː o̞kø,,,Il fait chaud aujourd‘hui,,
1-Commugny,Commugny,ei͉ fɑː θo wæː,,,Il fait chaud aujourd‘hui,,
1-Grone,Grone,ĭ feː tsa̠ː we̞i͉kç͉,,,Il fait chaud aujourd‘hui,,
1-Courtepin,Courtepin,jə fa̠ː tso vwe̞,,,Il fait chaud aujourd‘hui,,
1-LeSentier,LeSentier,fa̠ː tsŏ v͉wɛ̃i͉,,,Il fait chaud aujourd‘hui,,
1-Vermes,Vermes,æ fæː tʃɑ̝ː ɑ̝̃tʲø̞ː,,,Il fait chaud aujourd‘hui,,
1-Murist,Murist,ĕ fɑ̝ː tsŏ vwɛ̆,,,Il fait chaud aujourd‘hui,,
1-CoteauxFees,CoteauxFees,i feː tsa̠ː ă̠dʒŭdĭ,,,Il fait chaud aujourd‘hui,,
1-Fully,Fully,ĭ fĭ tso wæe͉,,,Il fait chaud aujourd‘hui,,
1-Chevroux,Chevroux,jə fa̠ː tsoː wɛ̆,,,Il fait chaud aujourd‘hui,,
1-Grimentz,Grimentz,ɪ̈ fĕ tsa̠ː vwɛ̆i͉kç͉,,,Il fait chaud aujourd‘hui,,
1-Vallorbe,Vallorbe,ĭ fɑ̝ː bɛ̃ĩ͉ tsŏ v͉wĭ,,,Il fait chaud aujourd‘hui,,
1-Montbovon,Montbovon,fa̠ tsoː wɛ,,,Il fait chaud aujourd‘hui,,
1-VillarsleTerroir,VillarsleTerroir,jə fa̠ː bɛ̃ĩ͉ tso wə,,,Il fait chaud aujourd‘hui,,
1-LAuberson,LAuberson,ĭ fɔː tsoː we̞ː,,,Il fait chaud aujourd‘hui,,
1-Miege,Miege,e̝ fĕi͉ tsa̠ːt wĕi͉,,,Il fait chaud aujourd‘hui,,
1-Court,Court,a̠ fa̠ː tʃŏ̞ ɔtçøŋ͉,,,Il fait chaud aujourd‘hui,,
1-Semsalves,Semsalves,i fɔː tso vɥɛ,,,Il fait chaud aujourd‘hui,,
1-Orvin,Orvin,ɛ fa̠ː tʃɔu ɔkɛj͉,,,Il fait chaud aujourd‘hui,,
1-Saviese,Saviese,ĭ fe̞ tsa̠ vwĭ,,,Il fait chaud aujourd‘hui,,
1-Laconnex,Laconnex,i fɔː tθo wă,,,Il fait chaud aujourd‘hui,,
1-Vaugondry,Vaugondry,fa̠ː tsŏ vwĭ,,,Il fait chaud aujourd‘hui,,
1-Champery,Champery,ĕ̞ fĭ tsɔ̆ wă̠,,,Il fait chaud aujourd‘hui,,
1-Orsieres,Orsieres,ĭ fĭ tsa̠ː wă̠ɛ͉,,,Il fait chaud aujourd‘hui,,
1-ChateaudOex,ChateaudOex,ĭ fa̠ː tsŏ wə,,,Il fait chaud aujourd‘hui,,
1-Hermance,Hermance,ĭ fɑ̝͜o θo̞u͉ wɛ̆,,,Il fait chaud aujourd‘hui,,
1-Courtedoux,Courtedoux,ɛ fæː tʃɑ̝ː ɑ̆ʒdø,,,Il fait chaud aujourd‘hui,,
1-Collombey,Collombey,e fei͉ tsŏ wɑ̝̃,,,Il fait chaud aujourd‘hui,,
1-Conthey,Conthey,ĭ fĭ tso vwæi͉,,,Il fait chaud aujourd‘hui,,
1-ChauxduMilieu,ChauxduMilieu,i fa̠ː tʃoː wĭ,,,Il fait chaud aujourd‘hui,,
1-Evolene,Evolene,ɪ̈ feːt͉ tsa̠ːt we̝k,,,Il fait chaud aujourd‘hui,,
1-AvrysurMatran,AvrysurMatran,fa̠ː tso ɥɛ̆,,,Il fait chaud aujourd‘hui,,
1-Arconciel,Arconciel,i fɑː tso wɛ̆,,,Il fait chaud aujourd‘hui,,
1-Collex,Collex,i fɔː θo we̞e͉,,,Il fait chaud aujourd‘hui,,
1-Noiraigue,Noiraigue,ɛ̆ feː tʃa̠ː wĭ,,,Il fait chaud aujourd‘hui,,
1-Nendaz,Nendaz,ĭ fe tsa̠ː wĕ̞i͉,,,Il fait chaud aujourd‘hui,,
1-Lamboing,Lamboing,ɛ fa̠ː tʃo ã̠ky̆,,,Il fait chaud aujourd‘hui,,
1-Develier,Develier,æ fæː tʃɑ̝ː ă̠dʒdœː,,,Il fait chaud aujourd‘hui,,
1-Boudry,Boudry,ɛ̆ fa̠ː tsŏ wĭ,,,Il fait chaud aujourd‘hui,,
2-Martigny,Martigny,l ë ɔ̃ bɔ̃ tɛ̃,,,C’est un bon temps,,
2-Dompierre,Dompierre,l ɛ̆ õ̞ bõ̞ tɛ̃,,,C’est un bon temps,,
2-Charnex,Charnex,l e ɔ̃ bɔ̃ tœ̃,,,C’est un bon temps,,
2-Roche,Roche,l ɛ̆ ɔ̃ bɔ̃ tɛ̃ː,,,C’est un bon temps,,
2-CerneuxPequignot,CerneuxPequignot,s a̠ ɪ̃ bʊ̃ tã̠,,,C’est un bon temps,,
2-Savagnier,Savagnier,s ɛ̆ ɔ̃ bɔ̃ tæː,,,C’est un bon temps,,
2-Longirod,Longirod,ei͉ fɑ̆ bɔ̃ŋ͉ tæː,,,C’est un bon temps,,
2-Sugiez,Sugiez,l e̞ õ̞ bõ̞ tɛ̃ŋ͉,,,C’est un bon temps,,
2-Landeron,Landeron,s e̞ ɔ̃ bɔ̃ tɑ̝ːɛ͉,,,C’est un bon temps,,
2-Vullierens,Vullierens,jə fɑ̆ ɔ̃ bɔ̃n͉ tæ̆,,,C’est un bon temps,,
2-Veyrier,Veyrier,j ɛ ɔ̃ bɔ̃ tã̠,,,C’est un bon temps,,
2-OrmontDessus,OrmontDessus,j ɛ̆ ɔ̃ bɔ̃ tɛ̃͜ĩ͉,,,C’est un bon temps,,
2-Montalchez,Montalchez,s ɛ ɔ̃ bɔ̃ŋ͉ tɛ̃,,,C’est un bon temps,,
2-Montpreveyres,Montpreveyres,l ɛ̆ ɔ̃ũ͉ bɔ̃ũ͉ tɛ̃ĩ͉,,,C’est un bon temps,,
2-Lourtier,Lourtier,ë ɔ̃ bɔ̃ tɛ̃,,,C’est un bon temps,,
2-Ayent,Ayent,lʲ͉ ɛ̆ ɔ̃ bɔ̃ tɛ̃ĩ͉,,,C’est un bon temps,,
2-Cerlatez,Cerlatez,s a̠ː ĩ bõ tã̠,,,C’est un bon temps,,
2-Corcelles,Corcelles,s ɛ̆ ɔ̃ bɔ̃ tæː,,,C’est un bon temps,,
2-Sombeval,Sombeval,s ɛ ɛ̃ bɔ̃ tɔ̆,,,C’est un bon temps,,
2-Vernier,Vernier,j ɛt ɔ̃ bɔ̃ tã̠,,,C’est un bon temps,,
2-StGingolph,StGingolph,j ĕ̞t ɔ̃ bɔ̃ tɛ̃,,,C’est un bon temps,,
2-Prahins,Prahins,l ɛ̆ ɔ̃ bɔ̃ tɛ̃ĩ͉,,,C’est un bon temps,,
2-Plagne,Plagne,θ ɛ ã̠͜ẽ̞͉ĩ͉ bã̠͉õ tɔ̆,,,C’est un bon temps,,
2-Commugny,Commugny,j ĕ̞ ɔ̃ bɔ̃ tã̠,,,C’est un bon temps,,
2-Grone,Grone,j ɛ̆t ŭŋ͉ bɔ̆n͉ tɛ̃ĩ͉ŋ͉,,,C’est un bon temps,,
2-Courtepin,Courtepin,jɛl ɛ õ̞ŋ͉ bõ̞ŋ͉ tẽĩ͉ŋ͉,,,C’est un bon temps,,
2-LeSentier,LeSentier,s ɛ̆t ə͉ɔ̃ũ͉ bə͉ɔ̃ũ͉ tæ̆,,,C’est un bon temps,,
2-Vermes,Vermes,s ɑ̆ ĩ bʊ̃ tɑ̝̃,,,C’est un bon temps,,
2-Murist,Murist,l ɛ̆ ɑ̝̃ŋ͉ bɑ̝̃ŋ͉ tɛ̃ĩ͉,,,C’est un bon temps,,
2-CoteauxFees,CoteauxFees,s ɛ̆ ɔ̃ bɔ̃ tæː,,,C’est un bon temps,,
2-Fully,Fully,ĭl ɛ̆ ɔ̃ bɔ̃ tɛ̃,,,C’est un bon temps,,
2-Chevroux,Chevroux,l ɛ̆ ɔ̃ bõ̞n͉ tɛ̃ĩ͉,,,C’est un bon temps,,
2-Grimentz,Grimentz,l ɛ̆θ ũ bɔ̃ŋ͉ tẽ̞ŋ͉,,,C’est un bon temps,,
2-Vallorbe,Vallorbe,s ɛ̆ ɔ̃ bɔ̃ tæ̆,,,C’est un bon temps,,
2-Montbovon,Montbovon,lʲ ɛ ɔ̃ bɔ̃ tɛ̃,,,C’est un bon temps,,
2-VillarsleTerroir,VillarsleTerroir,l ɛ̆ ɔ̃ bɔ̃ŋ͉ tɛ̆,,,C’est un bon temps,,
2-LAuberson,LAuberson,ĭ fɔː bɔ̃ te̞ː,,,C’est un bon temps,,
2-Miege,Miege,j ɛ̆t ʊ̃ bɔ̃n͉ tɛ̃,,,C’est un bon temps,,
2-Court,Court,s ɛ ɛ̃ bɔ̃ tɔ̆,,,C’est un bon temps,,
2-Semsalves,Semsalves,j ɛ ɔ̃ bɔ̃ tɛ̃,,,C’est un bon temps,,
2-Saviese,Saviese,l ë õn͉ bõ̞n͉ tɛ̃,,,C’est un bon temps,,
2-Laconnex,Laconnex,j ɛ ɔ̃ bɔ̃ tɛ̃,,,C’est un bon temps,,
2-Vaugondry,Vaugondry,s ɛ̆ ɔ̃ŋ͉ bɔ̃ŋ͉ tæ,,,C’est un bon temps,,
2-Champery,Champery,l ɛ̆ ɔ̃ bɔ̃ tẽ̞,,,C’est un bon temps,,
2-Orsieres,Orsieres,l ɛ̆ ɔ̃ bɔ̃ tæ̃,,,C’est un bon temps,,
2-ChateaudOex,ChateaudOex,d ɛ̆ õ bõ tœ̃,,,C’est un bon temps,,
2-Hermance,Hermance,j ɛ õ bõ tã̠,,,C’est un bon temps,,
2-Courtedoux,Courtedoux,s ɑ̝ː ĩ bʏ̃ tã̠,,,C’est un bon temps,,
2-Collombey,Collombey,ĕ̞ fe̞i͉ ɔ̃ bɔ̃ tɛ̃ɛ͉,,,C’est un bon temps,,
2-Conthey,Conthey,l ɛ̆ ɔ̃ bɔ̃ tɛ̃,,,C’est un bon temps,,
2-ChauxduMilieu,ChauxduMilieu,s ɛ ɔ̃ bɔ̃ tæːɛ͉,,,C’est un bon temps,,
2-Evolene,Evolene,j ɛ̆θ ŭn͉ bɔ̆n͉ tẽ̞ŋ͉,,,C’est un bon temps,,
2-AvrysurMatran,AvrysurMatran,l ɛ̆ ɔ̃ŋ͉ bɔ̃ŋ͉ tɛ̃ĩ͉,,,C’est un bon temps,,
2-Arconciel,Arconciel,l ɛ ɔ̃ bɔ̃ tɛ̃,,,C’est un bon temps,,
2-Collex,Collex,j ɛ ɔ̃ bõ tã̠,,,C’est un bon temps,,
2-Noiraigue,Noiraigue,s ɛ ɔ̃ bɔ̃ tɛː,,,C’est un bon temps,,
2-Nendaz,Nendaz,ɛ̆t ũ bɔ̃ tæ,,,C’est un bon temps,,
2-Lamboing,Lamboing,s ɛ ɔ̃ bɔ̃ tɛ̃,,,C’est un bon temps,,
2-Develier,Develier,s a̠ː ĩ bõ tɑ̃,,,C’est un bon temps,,
2-Boudry,Boudry,s ɛ̆ ɔ̃ bɔ̃ ta̠ːɛ͉,,,C’est un bon temps,,
3-Martigny,Martigny,õna̠ bwəna̠,,,Une bonne,,
3-Dompierre,Dompierre,una̠ bŭna̠,,,Une bonne,,
3-Charnex,Charnex,ɔ̃na̠ bŭna̠,,,Une bonne,,
3-Roche,Roche,ɔ̃na̠ bŭna̠,,,Une bonne,,
3-CerneuxPequignot,CerneuxPequignot,ɛ̆nɛ̆ bŭnɛ̆,,,Une bonne,,
3-Savagnier,Savagnier,ən bwɛ̆n,,,Une bonne,,
3-Longirod,Longirod,na̠ bwəna̠,,,Une bonne,,
3-Sugiez,Sugiez,ɔ̃na̠ bŭna̠,,,Une bonne,,
3-Landeron,Landeron,ɛn bwɛ̆n,,,Une bonne,,
3-Arnex,Arnex,na̠ bwɛ̆na̠,,,Une bonne,,
3-Vullierens,Vullierens,ɔ̃na̠ bŭna̠,,,Une bonne,,
3-Veyrier,Veyrier,na̠ bŭna̠,,,Une bonne,,
3-OrmontDessus,OrmontDessus,ɔ̃na̠ bŭna̠,,,Une bonne,,
3-Montalchez,Montalchez,na̠ bwëna̠,,,Une bonne,,
3-Montpreveyres,Montpreveyres,ɔ̃na̠ bŭna̠,,,Une bonne,,
3-Lourtier,Lourtier,ɔ̃na̠ boːnă,,,Une bonne,,
3-Ayent,Ayent,o̞ːna̠ bɔ̆na̠,,,Une bonne,,
3-Cerlatez,Cerlatez,ɛn bwën,,,Une bonne,,
3-Corcelles,Corcelles,ɛ̆na̠ bwɛ̆na̠,,,Une bonne,,
3-Sombeval,Sombeval,ɛn bɔ̆n,,,Une bonne,,
3-Vernier,Vernier,na̠ bŭna̠,,,Une bonne,,
3-StGingolph,StGingolph,na̠ bwëna̠,,,Une bonne,,
3-Prahins,Prahins,ɔ̃na̠ bŭna̠,,,Une bonne,,
3-Plagne,Plagne,ɛn bɔn,,,Une bonne,,
3-Commugny,Commugny,na̠ bŭna̠,,,Une bonne,,
3-Grone,Grone,ŭnːă̠ bɔ̆nːa̠,,,Une bonne,,
3-Courtepin,Courtepin,ɔ̃na̠ bŭna,,,Une bonne,,
3-LeSentier,LeSentier,ŭnă̠ bŭnă̠,,,Une bonne,,
3-Vermes,Vermes,ɛn bɔn,,,Une bonne,,
3-Murist,Murist,ɔ̃nă by̆nă̠,,,Une bonne,,
3-CoteauxFees,CoteauxFees,ɛ̆na̠ bŭnă̠,,,Une bonne,,
3-Fully,Fully,ɔ̃na̠ bw͉ʊ̈nːa̠,,,Une bonne,,
3-Chevroux,Chevroux,ɔ̃na̠ bŭna̠,,,Une bonne,,
3-Grimentz,Grimentz,ʊ̈na̠ bɔ̃ŋ͉na̠,,,Une bonne,,
3-Vallorbe,Vallorbe,ɛ̆na̠ bwöna̠,,,Une bonne,,
3-Montbovon,Montbovon,una̠ bŭnă̠,,,Une bonne,,
3-VillarsleTerroir,VillarsleTerroir,na̠ bŭna̠,,,Une bonne,,
3-LAuberson,LAuberson,nă̠ bnă̠,,,Une bonne,,
3-Miege,Miege,na̠ bɔ̆nă̠,,,Une bonne,,
3-Court,Court,ɛn bwɔ̆n,,,Une bonne,,
3-Semsalves,Semsalves,una̠ bŭna̠,,,Une bonne,,
3-Orvin,Orvin,ɔn bɔ̆n,,,Une bonne,,
3-Saviese,Saviese,ʊ̆nă̠ bo̞ːna̠,,,Une bonne,,
3-Laconnex,Laconnex,na̠ bŭna̠,,,Une bonne,,
3-Vaugondry,Vaugondry,na̠ bwɛ̆na̠,,,Une bonne,,
3-Champery,Champery,nă̠ bŭnă̠,,,Une bonne,,
3-Orsieres,Orsieres,ɔ̃na̠ boːna̠͉,,,Une bonne,,
3-ChateaudOex,ChateaudOex,ŭna̠ bŭna̠,,,Une bonne,,
3-Hermance,Hermance,na̠ bŭna̠,,,Une bonne,,
3-Courtedoux,Courtedoux,ɛn bwën,,,Une bonne,,
3-Collombey,Collombey,ĕ̞l ĕ̞ na̠ bwʊna̠,,,Une bonne,,
3-Conthey,Conthey,ɔ̃na̠ bɔ̃na̠,,,Une bonne,,
3-ChauxduMilieu,ChauxduMilieu,a̠͉na̠ ˈbŭˈnă̠,,,Une bonne,,
3-Evolene,Evolene,ŭnːa̠ bɔ̃na̠,,,Une bonne,,
3-AvrysurMatran,AvrysurMatran,ɔ̃na̠ bŭnːă̠,,,Une bonne,,
3-Arconciel,Arconciel,una̠ bŭna̠,,,Une bonne,,
3-Collex,Collex,na̠ bŭna̠,,,Une bonne,,
3-Noiraigue,Noiraigue,ɛ̆na̠ bwɛ̆na̠,,,Une bonne,,
3-Nendaz,Nendaz,ʊ̆na̠ bɔ̆na̠,,,Une bonne,,
3-Lamboing,Lamboing,ɛn bwən,,,Une bonne,,
3-Develier,Develier,ɛn bwën,,,Une bonne,,
3-Boudry,Boudry,ɛ̆na̠ bwɛ̆na̠,,,Une bonne,,
4-Martigny,Martigny,jə plø̞y͉ tsëkë͉ dzœ̆,,,Il pleut chaque jour,,
4-Dompierre,Dompierre,ɛ pja̠ː tĭ le̞ dzœ̆,,,Il pleut chaque jour,,
4-Charnex,Charnex,ĭ plʲæ͜ŏ tsă̠kə dzĕ̞,,,Il pleut chaque jour,,
4-Roche,Roche,ĭ plʲø̞ː tsă̠kə͉ dzɔ̆r,,,Il pleut chaque jour,,
4-CerneuxPequignot,CerneuxPequignot,ĭ plʲø ty̆ la̠ dʒœ̆,,,Il pleut chaque jour,,
4-Savagnier,Savagnier,ɛ pçø tʃă̠k dʒɔ̆r,,,Il pleut chaque jour,,
4-Longirod,Longirod,ei͉ pçy tsa̠ːkɛ dzœ̆,,,Il pleut chaque jour,,
4-Sugiez,Sugiez,jə pçɔ̆ tĭ le dzɔ̆r,,,Il pleut chaque jour,,
4-Landeron,Landeron,ɛ pçe tʃɑ̝k dʒɔ̆r,,,Il pleut chaque jour,,
4-Arnex,Arnex,jɛ̆ pça̠ö͉ tsă̠kə͉ dzwă̠,,,Il pleut chaque jour,,
4-Vullierens,Vullierens,jə pjɑ̝ː tsa̠kɛ dzɔ̆,,,Il pleut chaque jour,,
4-Veyrier,Veyrier,ĭ plʲy̆ θɔːk ðø̞,,,Il pleut chaque jour,,
4-OrmontDessus,OrmontDessus,jɛ̆ pɬa̠͜o̞ tɥĭ lu dzœ̆r͉,,,Il pleut chaque jour,,
4-Montalchez,Montalchez,ɛ pçø ty̆ lə dzɔ̆,,,Il pleut chaque jour,,
4-Montpreveyres,Montpreveyres,jɛ̆ pj̆ɑ̝ː tsă̠kʲɛ dzɔ̆,,,Il pleut chaque jour,,
4-Lourtier,Lourtier,ë plɔ tsɪ̈kɛ͉ dzö,,,Il pleut chaque jour,,
4-Ayent,Ayent,bă̠lʲɛ dɛ plɔ̆d͉ze̝͉ tse̝kə͉ d͉zɔ̆,,,Il pleut chaque jour,,
4-Corcelles,Corcelles,ɛ̆ pçø̆ ty̆ le dʒɔ̆r,,,Il pleut chaque jour,,
4-Vernier,Vernier,i plʲy̆ tɔ̆ lu ðœ,,,Il pleut chaque jour,,
4-StGingolph,StGingolph,e̞i͉ plɐu͉ tsa̠ːkə͉ dzœ̆rə͉,,,Il pleut chaque jour,,
4-Prahins,Prahins,jə plʲɑ̝ː tĭ lɛ̆ dzɔ̆,,,Il pleut chaque jour,,
4-Commugny,Commugny,ei͉ pçy̆ θa̠ːk ðœr͉,,,Il pleut chaque jour,,
4-Grone,Grone,ĭ pluː tsikçɛ zɔː,,,Il pleut chaque jour,,
4-Courtepin,Courtepin,jɛ̆ pçaːo̞͉ tĭ le dzwă,,,Il pleut chaque jour,,
4-LeSentier,LeSentier,plʲø̞y͉ tsa̠ːtʲɛ̆ dzœ̆,,,Il pleut chaque jour,,
4-Murist,Murist,e̞ plʲaː tĭ lɛ dzö,,,Il pleut chaque jour,,
4-CoteauxFees,CoteauxFees,i plø ty lĕ̞ dzœ̆,,,Il pleut chaque jour,,
4-Fully,Fully,ĭ plœ̆ʉ tsɪ̈kɛ͉ dzö,,,Il pleut chaque jour,,
4-Chevroux,Chevroux,jə pçɑ̝ː tsă̠kʲɛ dzɔ̆,,,Il pleut chaque jour,,
4-Grimentz,Grimentz,ɛ ˈdɔ̆nɛ tse̝kə͉ zɔ̆r,,,Il pleut chaque jour,,
4-Vallorbe,Vallorbe,ĭ pçøː tsă̠kə͉ dzœ̆,,,Il pleut chaque jour,,
4-Montbovon,Montbovon,i plʲa̠ː tĭ le dză̠,,,Il pleut chaque jour,,
4-VillarsleTerroir,VillarsleTerroir,jɛ plʲa̠ːö͉ tĭ lɛ dzɔ̆,,,Il pleut chaque jour,,
4-LAuberson,LAuberson,ĭ plʲyː ky̆ lŭ dzɛːr,,,Il pleut chaque jour,,
4-Miege,Miege,e̝ plʲ͉ŭt tse̝kɛ zɔ̆r,,,Il pleut chaque jour,,
4-Semsalves,Semsalves,i pçŏ tĭ lɛ dzwă̠,,,Il pleut chaque jour,,
4-Saviese,Saviese,ĭ plʲ͉ŭ twĭ ɛ dzɔ̆,,,Il pleut chaque jour,,
4-Laconnex,Laconnex,ĭ plʲy̆ t͉θɑ̝ːk ðœ̆r,,,Il pleut chaque jour,,
4-Vaugondry,Vaugondry,ɛ plʲø tsa̠cɛ dzwă̠,,,Il pleut chaque jour,,
4-Champery,Champery,e̞ pθø̞ twœj͉ lŭ dzø̞̆,,,Il pleut chaque jour,,
4-Orsieres,Orsieres,ĭ plɞ̆ʉ͉ tse̝kë͉ dzɞ̆,,,Il pleut chaque jour,,
4-ChateaudOex,ChateaudOex,ĭ pθa̠͜ʊ tsă̠cɛ dzɔ̆r,,,Il pleut chaque jour,,
4-Hermance,Hermance,ĭ plʲy̆ θɔːk ðœ,,,Il pleut chaque jour,,
4-Collombey,Collombey,ɛ̆ pθø̞y͉ tsă̠kə͉ dzö,,,Il pleut chaque jour,,
4-Conthey,Conthey,ɛ̆ pfø̞y͉ tɥĭ lɛ dzɔ̆,,,Il pleut chaque jour,,
4-ChauxduMilieu,ChauxduMilieu,ĭ pçø tʃă̠k dʒœ̆,,,Il pleut chaque jour,,
4-Evolene,Evolene,ɪ̈ pluːt͉ tsɪ̈kə͉ zɔ̆,,,Il pleut chaque jour,,
4-AvrysurMatran,AvrysurMatran,i plʲa̠ːö͉ tĭ le̞ dʒ̟ɥæ,,,Il pleut chaque jour,,
4-Arconciel,Arconciel,i plʲa̠ː tĭ lĕ̞ dzwă,,,Il pleut chaque jour,,
4-Collex,Collex,e plʲy̆ θɔːk ðø,,,Il pleut chaque jour,,
4-Noiraigue,Noiraigue,ɛ̆ pçø ty̆ lĕ̞ dʒœ̆r,,,Il pleut chaque jour,,
4-Nendaz,Nendaz,ĭ plʲ͉ʉ tsĭkə͉ dzɔ̆,,,Il pleut chaque jour,,
4-Boudry,Boudry,ɛ̆ pçø ty̆ le̞ dzɔ̆r,,,Il pleut chaque jour,,
5-Martigny,Martigny,jɛ j a̠veː pu də rɔ̆ʒ̟o,,,hier il y avait peu de rosée,,
5-Dompierre,Dompierre,jɛː lɛj a̠vɛː pu dɛ̆ rɔ̆zɑː,,,hier il y avait peu de rosée,,
5-Charnex,Charnex,jɛː lɛ̆j ă̠vɑ̝ːj͉ puː dĕ̞ ro̞ːzɑ̝ː,,,hier il y avait peu de rosée,,
5-Roche,Roche,jɛːr læ̆j ă̠va̠͜ɛ puː dɛ̆ rɔ̆zɑ̝ː,,,hier il y avait peu de rosée,,
5-CerneuxPequignot,CerneuxPequignot,jiːə͉ ĭ n ɛ̆væː vwaːru d rɔ̆zɛː,,,hier il y avait peu de rosée,,
5-Savagnier,Savagnier,jɪːr ɛ j a̠ve pŭ də rɔ̆zɛːj͉,,,hier il y avait peu de rosée,,
5-Longirod,Longirod,jɛ j a̠va̠͜e pŭ dɛ̆ ro̞zɑː,,,hier il y avait peu de rosée,,
5-Sugiez,Sugiez,jɛr lɛ̆j a̠vɛ pu de̞ rɔ̆za̠,,,hier il y avait peu de rosée,,
5-Landeron,Landeron,jiːr ɛ j a̠vɑ̝ːɛ͉ pu də rɔzeːj,,,hier il y avait peu de rosée,,
5-Arnex,Arnex,je̞ː j a̠vaːɛ͉ pŭ dɛ̆ rɔ̆za̠ː,,,hier il y avait peu de rosée,,
5-Vullierens,Vullierens,jɛː j ă̠vɑːɛ͉ puː dɛ̆ rɔ̆zɑːjə͉,,,hier il y avait peu de rosée,,
5-Veyrier,Veyrier,jɛː j a̠vɛː pŭ də rɔzɑ̝͜o͉,,,hier il y avait peu de rosée,,
5-OrmontDessus,OrmontDessus,jɛ̆r j ă̠væː pŭ dɛ̆ rɔză̠,,,hier il y avait peu de rosée,,
5-Montalchez,Montalchez,jø lʲ ă̠va̠ːe͉ pu də ʁɔ̆za̠ːj,,,hier il y avait peu de rosée,,
5-Montpreveyres,Montpreveyres,jɛː lɛ̆j ă̠va̠ː pŭ dɛ̆ rɔ̆za̠ː,,,hier il y avait peu de rosée,,
5-Lourtier,Lourtier,jɛː j a̠ːi͉ pŭ dɛə͉ ʁɔ̆ʒo,,,hier il y avait peu de rosée,,
5-Ayent,Ayent,jɛːr͉ l a̠.i pŏ dɛ rɔ̆ʒŏ,,,hier il y avait peu de rosée,,
5-Cerlatez,Cerlatez,iːə͉ æ n j a̠væ ka̠ːzĭ puːø̞͉̃ də roːzæː,,,hier il y avait peu de rosée,,
5-Corcelles,Corcelles,j͉iːr ɛ nʲ ă̠væ̆ rɛ̆ d rɔ̆za̠ːj,,,hier il y avait peu de rosée,,
5-Sombeval,Sombeval,jiː a̠ nʲ a̠vɛ wɛr d rozæː,,,hier il y avait peu de rosée,,
5-Vernier,Vernier,jɛ̆ j a̠va̠͜e͉ pu d rɔ̆zɔːjə͉,,,hier il y avait peu de rosée,,
5-StGingolph,StGingolph,jɛː j a̠væi͉ pŭ dɛ ro̞ːzŏ,,,hier il y avait peu de rosée,,
5-Prahins,Prahins,jɛː læj ă̠væː puː dɛ̆ rɔ̆za̠ːjə͉,,,hier il y avait peu de rosée,,
5-Plagne,Plagne,iə͉r a̠ j a̠vɑːɛ͉ pɑːɛ͉ də roːzɛː,,,hier il y avait peu de rosée,,
5-Commugny,Commugny,jɛː j a̠vɛː pŭ dɛ̆ rɔ̆ʒɑ̝ː,,,hier il y avait peu de rosée,,
5-Grone,Grone,je ij a̠vɛ̆kç͉ pʊ dɛ rɔʒɑ̆,,,hier il y avait peu de rosée,,
5-Courtepin,Courtepin,jɛː le̞j a̠vaː puː dɛ ro̞ːʒaː,,,hier il y avait peu de rosée,,
5-LeSentier,LeSentier,je j ă̠va̠͜ɛ pʊː dɛ̆ rɔ̆zɑː,,,hier il y avait peu de rosée,,
5-Vermes,Vermes,jiːə͉r ɛ nʲj ævæː vwɛːr də roːzɑ̝̃,,,hier il y avait peu de rosée,,
5-Murist,Murist,je̞ː lɛːj ă̠vɛː pu dɛ̆ rɔ̆zɑ̝ː,,,hier il y avait peu de rosée,,
5-CoteauxFees,CoteauxFees,vjøː ĭ nʲ ă̠vɛ̆ voːru͉ də͉ rɔ̆za̠ː,,,hier il y avait peu de rosée,,
5-Fully,Fully,je j a̠væi pŭ də ʁɔ̆ʒ̟ŏ,,,hier il y avait peu de rosée,,
5-Chevroux,Chevroux,jɛːr lɛj ă̠vɛ pu dɛ rɔ̆zɑ̝ːjë͉,,,hier il y avait peu de rosée,,
5-Grimentz,Grimentz,jɛ̆r l ă̠.iː pŏu dɛ rɔ̆ʒ̟ă̠,,,hier il y avait peu de rosée,,
5-Vallorbe,Vallorbe,vjœ̆ j ă̠væː puː dɛ̆ rŭzɑ̝ː,,,hier il y avait peu de rosée,,
5-Montbovon,Montbovon,jɛː lʲ a̠ve pŭ dɛ rɔʒɑː,,,hier il y avait peu de rosée,,
5-VillarsleTerroir,VillarsleTerroir,jɛː læ̆j ă̠va̠ːɛ͉ pŭ dɛ̆ rɔ̆za̠ː,,,hier il y avait peu de rosée,,
5-LAuberson,LAuberson,jeː j ă̠ve̞ː py̆ dɛ̆ rɔ̆zɔːj͉,,,hier il y avait peu de rosée,,
5-Miege,Miege,jɛ̆r ĭ a̠vĭt͉ pŏu dɛ rɔ̆ʒa̠,,,hier il y avait peu de rosée,,
5-Court,Court,jiːr a̠ nʲj a̠vɛ wɛːr də roːzɛː,,,hier il y avait peu de rosée,,
5-Semsalves,Semsalves,jɛː il j a̠ve pu dɛ rɔ̆ʒ̟ɑ̝,,,hier il y avait peu de rosée,,
5-Orvin,Orvin,iːə͉r ɛ j a̠vɛj pa̠͜ŭ d rou͉zæː,,,hier il y avait peu de rosée,,
5-Saviese,Saviese,jɛː l æ.ˈiːɛ pʊu͉ dɛ rɔ̆ʒa̠,,,hier il y avait peu de rosée,,
5-Laconnex,Laconnex,jɛː j a̠va̠͜ɛ pɑ̝o͉ də rɔ̆zɑ̝͜o,,,hier il y avait peu de rosée,,
5-Vaugondry,Vaugondry,jøː lʲ a̠væː puː dɛ̆ rɔ̆za̠ː,,,hier il y avait peu de rosée,,
5-Champery,Champery,jĕ̞ lă̠j ă̠vɑː py̆ d ă̠rɔ̆zɔ,,,hier il y avait peu de rosée,,
5-Orsieres,Orsieres,jɛ̆ j eːrɛ͉ pŭ dɛ rɔ̆zŏ,,,hier il y avait peu de rosée,,
5-ChateaudOex,ChateaudOex,jər͉ læːi͉ ă̠væĭ pŭ dɛ̆ rɔ̆ʒa̠ː,,,hier il y avait peu de rosée,,
5-Hermance,Hermance,jɛː j a̠vɛ̆ py̆ də rɔ̆zɔːjə͉,,,hier il y avait peu de rosée,,
5-Courtedoux,Courtedoux,jiːë͉ æ̆ j ævæː po d roːzæː,,,hier il y avait peu de rosée,,
5-Collombey,Collombey,jeːɛ͉ lă̠j a̠vɑːvɛ͉ pŭ d a̠rɔ̆zoː,,,hier il y avait peu de rosée,,
5-Conthey,Conthey,jɛː j ă̠veː pŭ də rɔ̆ʒ̟oː,,,hier il y avait peu de rosée,,
5-ChauxduMilieu,ChauxduMilieu,jɛ̆ i j a̠vɛ̆ puː d ʁɔ̆zeːj͉,,,hier il y avait peu de rosée,,
5-Evolene,Evolene,jɛːr j a̠vĕi͉k͉ puː dɛ ză̠liːrɪ͉̈,,,hier il y avait peu de rosée,,
5-AvrysurMatran,AvrysurMatran,jɛː lɛj a̠vɑːɛ͉ pŭ dɛ rɔ̆ʒ̟ɑː,,,hier il y avait peu de rosée,,
5-Arconciel,Arconciel,jɛː lʲ ă̠væː pu dɛ rɔ̆ʒɑ̝ː,,,hier il y avait peu de rosée,,
5-Collex,Collex,jɛːr j a̠vɛː pu d rɔ̆zŏ̞,,,hier il y avait peu de rosée,,
5-Noiraigue,Noiraigue,iːr ɛ̆ nʲ ă̠vɛ̆ ˈvwa̠ːrɔ̆ d rɔ̆zeːj͉,,,hier il y avait peu de rosée,,
5-Nendaz,Nendaz,jë a̠.ɪ̈ py̆ də rɔʒɑː,,,hier il y avait peu de rosée,,
5-Lamboing,Lamboing,jiːə͉r ɛ j ɛːv pø d rɔzɛːj,,,hier il y avait peu de rosée,,
5-Develier,Develier,jiːə͉ æ n j ævæː vwæːr də rozæː,,,hier il y avait peu de rosée,,
5-Boudry,Boudry,jiːr ɛ̆ lʲ ă̠va̠ːɛ͉ pŭ d rɔ̆za̠ːj,,,hier il y avait peu de rosée,,
6-Martigny,Martigny,jə fa̠ʒ̟e̞ː fre̞i͉,,,Il faisait froid,,
6-Dompierre,Dompierre,jə fă̠zɛːj͉ frɑːɛ͉,,,Il faisait froid,,
6-Charnex,Charnex,ĭ făzɑ̝ːj͉ frɑ̝ːj͉,,,Il faisait froid,,
6-Roche,Roche,ĭ fă̠zɑːɛ͉ frɑːɛ͉,,,Il faisait froid,,
6-CerneuxPequignot,CerneuxPequignot,ĭ fɛ̆sɛ̆ fræ̆,,,Il faisait froid,,
6-Savagnier,Savagnier,i fzeː freː,,,Il faisait froid,,
6-Longirod,Longirod,ĭ fă̠zĭvɛ͉ fra̠ː,,,Il faisait froid,,
6-Sugiez,Sugiez,jə fă̠zɛː frɛ̆,,,Il faisait froid,,
6-Landeron,Landeron,ɛ fə͉zɑ̝ːɛ͉ frɑ̝ːə͉,,,Il faisait froid,,
6-Arnex,Arnex,jë fa̠za̠ːɛ͉ fraːɛ͉,,,Il faisait froid,,
6-Vullierens,Vullierens,fă̠za̠ːɛ͉ frɑː,,,Il faisait froid,,
6-Veyrier,Veyrier,ĭ fa̠sa̠͉ɛː fra̠͉ɛː,,,Il faisait froid,,
6-OrmontDessus,OrmontDessus,jɛ̆ fă̠sa̠͜æ fra̠͜æː,,,Il faisait froid,,
6-Montalchez,Montalchez,ɛ̆ fəză̠e͉ fʁa̠e͉,,,Il faisait froid,,
6-Montpreveyres,Montpreveyres,jə fă̠ză̠͜ɛ fra̠ː,,,Il faisait froid,,
6-Lourtier,Lourtier,ɛə͉ făʒa̠ː fra̠ː,,,Il faisait froid,,
6-Ayent,Ayent,fă̠ʒĕi͉ frĕi,,,Il faisait froid,,
6-Cerlatez,Cerlatez,æ fzæː frwă̠,,,Il faisait froid,,
6-Corcelles,Corcelles,ɛ̆ fzæː fræː,,,Il faisait froid,,
6-Sombeval,Sombeval,a̠ fa̠zɛ frɛ,,,Il faisait froid,,
6-StGingolph,StGingolph,ɛ̆i͉ fă̠sæi fræi,,,Il faisait froid,,
6-Prahins,Prahins,jə fă̠zæː fræː,,,Il faisait froid,,
6-Plagne,Plagne,a̠ fa̠zɑːɛ͉ frɑːə͉,,,Il faisait froid,,
6-Commugny,Commugny,ei͉ fa̠zɛː fræː,,,Il faisait froid,,
6-Grone,Grone,ĭ fɛ̆ʒĕi͉ frɛ̆kç͉,,,Il faisait froid,,
6-Courtepin,Courtepin,jə fă̠ʒe̞j͉ fraːe̞͉,,,Il faisait froid,,
6-LeSentier,LeSentier,fă̠za̠͉ɛː frɛ̆i͉,,,Il faisait froid,,
6-Vermes,Vermes,ɛ fæzæ fræː,,,Il faisait froid,,
6-Murist,Murist,jə fă̠zɛ̆j͉ frɑ̝,,,Il faisait froid,,
6-CoteauxFees,CoteauxFees,ĭ fă̠zɛ̆ frɛ̆,,,Il faisait froid,,
6-Fully,Fully,ĭ fă̠zæi fræi,,,Il faisait froid,,
6-Chevroux,Chevroux,jə fəze̞i͉ frɑː,,,Il faisait froid,,
6-Grimentz,Grimentz,ĭ făʒi fri,,,Il faisait froid,,
6-Vallorbe,Vallorbe,ĭ fă̠zæː fræː,,,Il faisait froid,,
6-Montbovon,Montbovon,i fă̠ʒe frɛː,,,Il faisait froid,,
6-VillarsleTerroir,VillarsleTerroir,jɛ fă̠za̠ːɛ͉ fra̠ːɛ͉,,,Il faisait froid,,
6-LAuberson,LAuberson,ĭ fă̠ze̞ː fre̞ː,,,Il faisait froid,,
6-Miege,Miege,ĭ fa̠ʒĭ frĭt,,,Il faisait froid,,
6-Court,Court,a̠ fă̠zɛː frɛː,,,Il faisait froid,,
6-Semsalves,Semsalves,i fă̠ʒ̟ə fra̠,,,Il faisait froid,,
6-Orvin,Orvin,ɛ fa̠zæj͉ fræj͉,,,Il faisait froid,,
6-Saviese,Saviese,fă̠ˈʒiːɛ͉ frĭ,,,Il faisait froid,,
6-Laconnex,Laconnex,i făsa̠͜ɛ fră,,,Il faisait froid,,
6-Vaugondry,Vaugondry,fa̠zæː fræː,,,Il faisait froid,,
6-Champery,Champery,e̞ fă̠sa̠ fra̠ɛ͉,,,Il faisait froid,,
6-Orsieres,Orsieres,ĭ fă̠zeː fræ̆i͉,,,Il faisait froid,,
6-ChateaudOex,ChateaudOex,ĭ fă̠ʒ̟æ̆i fræ̆i,,,Il faisait froid,,
6-Hermance,Hermance,ĭ făsɛ̆ frɛ,,,Il faisait froid,,
6-Courtedoux,Courtedoux,æ̆ fzɛː frwă̠,,,Il faisait froid,,
6-Collombey,Collombey,ĕ̞ fɑ̆zɑːvɛ͉ frɑː,,,Il faisait froid,,
6-Conthey,Conthey,ĭ fă̠ʒ̟eː fræːi,,,Il faisait froid,,
