ID,Language_ID,Primary_Text,Analyzed_Word,Gloss,Translated_Text,Meta_Language_ID,Comment
42-Sugiez,Sugiez,sĭ læːʃy̆ l e mĕ̞lʲɔ tʲe̞ l oːtrɔ͉,,,Ce drap de lit est meilleur que l’autre,,
42-Landeron,Landeron,su ʎɛse ɛ mɛjer kə l oːtr,,,Ce drap de lit est meilleur que l’autre,,
42-Arnex,Arnex,se lɛ̃ĩ͉sy ɛ̆ mɛ̆ja̠ːɔ͉ kɛ̆ l oːtrɔ͉,,,Ce drap de lit est meilleur que l’autre,,
42-Vullierens,Vullierens,se lɛ̃ĩ͉sy̆ ɛ̆ mɛjɑː kɛ̆ l oːtrɔ͉,,,Ce drap de lit est meilleur que l’autre,,
42-Veyrier,Veyrier,se lã̠fwă̠ el ɛ mɛlʲø k l a̠͉͜ɔtrö͉,,,Ce drap de lit est meilleur que l’autre,,
42-OrmontDessus,OrmontDessus,se lɥɛ̃ɬĕ̞ ɛ̆ mɛ̆ɮa̠͜ɔ tʲɛ̆ l a̠ːtrə͉,,,Ce drap de lit est meilleur que l’autre,,
42-Montalchez,Montalchez,sy̆ lɛ̃sy̆ ɛ̆ mɛ̆lʲa̠e͉ kə l otʁɔ͉,,,Ce drap de lit est meilleur que l’autre,,
42-Montpreveyres,Montpreveyres,sĭ lɛ̃ːçy̆ l ɛ̆ mɛ̆lʲɑːɔ͉ tʲë l oːtru͉,,,Ce drap de lit est meilleur que l’autre,,
42-Lourtier,Lourtier,ʃ̟ẽĩ͉ ɛ̃çl͉ʲ y͜ə ɛə͉ mɛ̆lʲ͉ø̞ kë a̠ːtrə͉,,,Ce drap de lit est meilleur que l’autre,,
42-Ayent,Ayent,ʃĭ lə̃ʃ̟ɥĕ̞ lʲ ɛ̆ mɛ̆lʲø kçɛ l ɑːtrɛ͉,,,Ce drap de lit est meilleur que l’autre,,
42-Cerlatez,Cerlatez,lsyːə͉ æl a̠ː mwă̠jŭ kə l a̠ːtr,,,Ce drap de lit est meilleur que l’autre,,
42-Corcelles,Corcelles,sty̆ lʲɛ̆ʃø̆ voː miː k l oːtr,,,Ce drap de lit est meilleur que l’autre,,
42-Sombeval,Sombeval,dră̠ d je a̠l ɛ mwa̠jy k l oːtr,,,Ce drap de lit est meilleur que l’autre,,
42-Vernier,Vernier,lã̠ːˈfuːa̠͉ ĭl ɛ̆ mɛ̆lʲø k l a̠͉ɔːtrə͉,,,Ce drap de lit est meilleur que l’autre,,
42-StGingolph,StGingolph,sĭ lɛ̃fwă̠ ĕ̞ mɛj̆ɐu͉ kə l oːtrə͉,,,Ce drap de lit est meilleur que l’autre,,
42-Prahins,Prahins,sɪ̆ lɛ̃sʏ̆ l ɛ̆ mɛ̆lʲɔː tʲɛ̆ l oːtro̞͉,,,Ce drap de lit est meilleur que l’autre,,
42-Plagne,Plagne,jə͉sø̞ ɛ ma̠jŭ kə l ɔːtr,,,Ce drap de lit est meilleur que l’autre,,
42-Commugny,Commugny,dra̠ː də lʲɛː ɛ̆ mɛ̆lʲœː k l ɑːtrö͉,,,Ce drap de lit est meilleur que l’autre,,
42-Grone,Grone,ste̝i͉ lɛ̃sɥë j ɛ̆ mɛ̆lʲou͉ kɛ̆ l a̠ːtrə͉,,,Ce drap de lit est meilleur que l’autre,,
42-Courtepin,Courtepin,çi lã̠ʃ̟jyː l ɛ mɛ̆ʎaːo͉ tʲɛ l oːtru͉,,,Ce drap de lit est meilleur que l’autre,,
42-LeSentier,LeSentier,sĕ lẽ̞ĩ͉ʃø͉ʏ̆ l ɛ̆ mɛ̆lʲa̠͜o tʲɛ̆ l oːtru͉,,,Ce drap de lit est meilleur que l’autre,,
42-Vermes,Vermes,jĭsyːə͉ a̠l ɑ̝ː mwăjŭ tʲə͉ l ɑ̝trə͉,,,Ce drap de lit est meilleur que l’autre,,
42-Murist,Murist,si læçy l ɛ mĕ̞lʲaː tʲɛ l oːtru͉,,,Ce drap de lit est meilleur que l’autre,,
42-CoteauxFees,CoteauxFees,sty læ̆sø ɛ̆ mɛ̆lʲœ̆ k l a̠ːtru͉,,,Ce drap de lit est meilleur que l’autre,,
42-Fully,Fully,se lɛ̃fwĕ̞ l ɛ̆ mɛ̆jø̞ː kɛ l a̠ːtrö͉,,,Ce drap de lit est meilleur que l’autre,,
42-Chevroux,Chevroux,si lɛ̃ʃy̆ ɛ̆ mɛ̆lʲa̠͜ɔ͉ kë l oːtru͉,,,Ce drap de lit est meilleur que l’autre,,
42-Grimentz,Grimentz,stik͉ lɪːŋ͉swœ̆ʟ l ɛ̆ mɛ̆ʟou͉ kɛ l a̠ːtre͉,,,Ce drap de lit est meilleur que l’autre,,
42-Vallorbe,Vallorbe,sjy̆ lɛ̃søː ɛ̆ mɛ̆lʲŏ kə l oːtru͉,,,Ce drap de lit est meilleur que l’autre,,
42-Montbovon,Montbovon,ʃi lɛ̃çy̆ lʲ ɛ mɛ̆lʲa̠ kə l oːtrö͉,,,Ce drap de lit est meilleur que l’autre,,
42-VillarsleTerroir,VillarsleTerroir,si lɛːsy̆ ɛ̆ mĕ̞lʲa̠ːɔ͉ tʲɛ l oːtro̞͉,,,Ce drap de lit est meilleur que l’autre,,
42-LAuberson,LAuberson,se lɛːsy̆ ɛ̆ mɛ̆lʲø̆ kɛ̆ l ɔːtr,,,Ce drap de lit est meilleur que l’autre,,
42-Miege,Miege,ʃtĭ lɪ̃sɥɛ̆ j ɛ̆ mɛ̆lʲoːu͉r kɛ l a̠ːtre̝͉,,,Ce drap de lit est meilleur que l’autre,,
42-Court,Court,iːsʏŋ͉ a̠l ɛ mwa̠jŭ tʲ l o̞tr,,,Ce drap de lit est meilleur que l’autre,,
42-Semsalves,Semsalves,ʃ̟ĭ lɛ̃çy̆ j ɛ mɛ̆ja̠ː tʲɛ l oːtru͉,,,Ce drap de lit est meilleur que l’autre,,
42-Orvin,Orvin,tʲsœy͉ ɛ mædʲu k l ɔutr,,,Ce drap de lit est meilleur que l’autre,,
42-Saviese,Saviese,ʃtɪ̆ o̞͉ɛ̃swĕ̞ l ë mɛ̆lʊ kɛ o̞͉ a̠ːtrə͉,,,Ce drap de lit est meilleur que l’autre,,
42-Laconnex,Laconnex,lɛ̃fʏ̆ a̠l ɛ mɛ̆lʲœy͉ k l ɔːtrə͉,,,Ce drap de lit est meilleur que l’autre,,
42-Vaugondry,Vaugondry,si lɛ̃sy l ɛ mɛ̆lʲø kɛ̆ l oːtrɔ͉,,,Ce drap de lit est meilleur que l’autre,,
42-Champery,Champery,ʃ̟ĕ̞ lɛ̃θwɑ̆ ɛ̆ mɛ̆ðœː kə l aːtro̞͉,,,Ce drap de lit est meilleur que l’autre,,
42-Orsieres,Orsieres,sĕ lɛ̃sɥĕ̝ l ɛ mɛ̆jœː kɛ̆ l a̠ːtrʊ͉̈,,,Ce drap de lit est meilleur que l’autre,,
42-ChateaudOex,ChateaudOex,ʃĭ lɛ̃ːθy̆ d ɛ̆ mɛ̆dɔːr͉ tʲɛ̆ l oːtrɔ͉,,,Ce drap de lit est meilleur que l’autre,,
42-Hermance,Hermance,lã̠ˈfwă̠ ɛl ɛ mɛ̆lʲø̞y͉ kə l a̠͉ɔːtro̞͉,,,Ce drap de lit est meilleur que l’autre,,
42-Courtedoux,Courtedoux,jəsyːə͉ æl a̠ mwă̠ju k l a̠ːtr,,,Ce drap de lit est meilleur que l’autre,,
42-Collombey,Collombey,sĭ lɛ̃fwĕ̞ ĕ̞ mjɔ̆ kə l aːtrɔ͉,,,Ce drap de lit est meilleur que l’autre,,
42-Conthey,Conthey,sĭ lɛ̃θwe ɛ̆ mɛ̆dø̆ kɛ a̠ːtrə͉,,,Ce drap de lit est meilleur que l’autre,,
42-ChauxduMilieu,ChauxduMilieu,sty̆ lʲă̠sø̆ ɛ mɛ̆lʲy̆ k l oːtʁ,,,Ce drap de lit est meilleur que l’autre,,
42-Evolene,Evolene,ʃɪ̈ lɪ̈nsɥë ɛ̆ mɛ̆lʲŏu͉ kɛ̆ l a̠ːtre̝͉,,,Ce drap de lit est meilleur que l’autre,,
42-AvrysurMatran,AvrysurMatran,sĭ lãçj͉y̆ l ɛ mɛ̆lʲa̠ː tʲɛ l oːtru͉,,,Ce drap de lit est meilleur que l’autre,,
42-Arconciel,Arconciel,ʃi lɛ̃çy̆ l ɛ̆ mɛ̆lʲa̠ː kə l oːtrɔ͉,,,Ce drap de lit est meilleur que l’autre,,
42-Collex,Collex,drɑ̝ d lʲɛ̆ ɛ mɛ̆lʲy̞ k l ɑ̝ːtrö͉,,,Ce drap de lit est meilleur que l’autre,,
42-Noiraigue,Noiraigue,sty̆ lʲɛ̆sy̆ ɛ̆ mɛ̆lʲœ̆r k l a̠ːtrɔ͉,,,Ce drap de lit est meilleur que l’autre,,
42-Nendaz,Nendaz,ʃĭ ə̃swë ɛ̆ mɛ̆lɞ̆u͉ kɛ a̠ːtrə͉,,,Ce drap de lit est meilleur que l’autre,,
42-Lamboing,Lamboing,sy jã̠sy ɛ mɛjœ̆r kə l oːtr,,,Ce drap de lit est meilleur que l’autre,,
42-Develier,Develier,jy̆syːə͉ æl ɑː mwăju k l ɑːtr,,,Ce drap de lit est meilleur que l’autre,,
42-Boudry,Boudry,sty̆ lʲɛ̆ʃø ɛ̆ mɛ̆lʲœ̆r kə l oːtr,,,Ce drap de lit est meilleur que l’autre,,
43-Martigny,Martigny,a̠ ʊ̃na̠ ˈla̠ːrdzø döbla̠͉,,,Il a une largeur double,,
43-Dompierre,Dompierre,l a̠ na̠ la̠rdʒɑ̝ː drɔ̆bja̠,,,Il a une largeur double,,
43-Charnex,Charnex,ĭl ă drɔ̆blʲă̠ lă̠rdʒœ͉͜o,,,Il a une largeur double,,
43-Roche,Roche,l ă̠ dro̞ːblʲa̠ lă̠rdʒø̞ːr,,,Il a une largeur double,,
43-CerneuxPequignot,CerneuxPequignot,ɛ ɛ̆nɛ̆ læ̆rdʒu ˈdŭblʲu,,,Il a une largeur double,,
43-Savagnier,Savagnier,ɛl a̠ drøːbj lă̠rdʒø̞ːr,,,Il a une largeur double,,
43-Longirod,Longirod,l a̠ na̠ lă̠rʒø̞ː dro̞ːblʲă̠,,,Il a une largeur double,,
43-Sugiez,Sugiez,l a̠ ˈdrɔ̆bjă̠ lă̠rˈdʒɔ̆,,,Il a une largeur double,,
43-Landeron,Landeron,ɛl a̠ ɛn la̠rdʒe̞ːr drebʎ,,,Il a une largeur double,,
43-Arnex,Arnex,l a̠ na̠ la̠rdʒa̠ːɔ͉ dro̞ːbja̠,,,Il a une largeur double,,
43-Vullierens,Vullierens,l ɛ̆ drɔ̆bjɔ͉ dɛ̆ lă̠rdʒɑː,,,Il a une largeur double,,
43-Veyrier,Veyrier,el a̠ nă̠ lă̠rðjø drɔ̆blʲa̠͉,,,Il a une largeur double,,
43-OrmontDessus,OrmontDessus,ɛɮ ɛ̆ ˈdrɔ̆bɮa̠ lă̠rd͉zja̠ː͜ɔ͉,,,Il a une largeur double,,
43-Montalchez,Montalchez,ĕ̞l ɛ dʁɔ̆bjɔ də lăʁdʒa̠e̝͉,,,Il a une largeur double,,
43-Montpreveyres,Montpreveyres,l ă̠ ɔ̃na̠ lă̠rdʒɑ̝ː dro̞ːblʲa̠͉,,,Il a une largeur double,,
43-Lourtier,Lourtier,a̠ ɔ̃na̠ aʁdzjɔː döblʲ͉ă,,,Il a une largeur double,,
43-Ayent,Ayent,l a̠ lɔ̆ dɔ̆bʟɔ dă̠ la̠ːrdʒ̟j͉ø̆,,,Il a une largeur double,,
43-Corcelles,Corcelles,ɛ̆l ă̠ drøːbj lă̠rdʒøːr,,,Il a une largeur double,,
43-Vernier,Vernier,ĭl a̠ nă̠ la̠rʒø̞̆ drɔ̆blʲa̠͉,,,Il a une largeur double,,
43-StGingolph,StGingolph,e̞ːr a̠ nă̠ lă̠rʒøːrə͉ dröbla̠͉,,,Il a une largeur double,,
43-Prahins,Prahins,l ɑ̆ ɔ̃na̠ lă̠rdʒɑ̝ː dro̞ːbʎă̠,,,Il a une largeur double,,
43-Commugny,Commugny,a̠ na̠ la̠rʒøː dro̞ːblʲă̠,,,Il a une largeur double,,
43-Grone,Grone,j ă̠ ŭna̠ la̠ːrdʒ̟j͉o̞u͉k dɔ̆bla̠,,,Il a une largeur double,,
43-Courtepin,Courtepin,jɛl ă̠ ɔ̃na̠ lɛ̆rdʒjă̠ drɔ̆bjă̠,,,Il a une largeur double,,
43-LeSentier,LeSentier,l a̠ ŭna̠ læ̆rdʒă̠͜ʊ̆ drɔ̆blʲă̠,,,Il a une largeur double,,
43-Murist,Murist,el a̠ ɔ̃na̠ lă̠rdʒj͉aː drɔ̆bja̠,,,Il a une largeur double,,
43-CoteauxFees,CoteauxFees,l ă̠ ɛ̆na̠ lɛ̆rdʒœ̆ dø̞̆bla̠,,,Il a une largeur double,,
43-Fully,Fully,ĭl ă̠ nă̠ lă̠dzø̞ː döbla̠͉,,,Il a une largeur double,,
43-Chevroux,Chevroux,l a̠ ɔ̃na̠ lă̠rdza̠ːɔ͉ ˈdrŏ̞bjă̠,,,Il a une largeur double,,
43-Grimentz,Grimentz,l a̠ dɔ̆bʟa̠ la̠ːrzjŏu͉,,,Il a une largeur double,,
43-Vallorbe,Vallorbe,l a̠ ɛ̆na̠ lɛ̆rdʒo drŭblʲa̠͉,,,Il a une largeur double,,
43-Montbovon,Montbovon,lʲ a̠ na̠ la̠rdʒj͉a̠ːɔ͉ drɔ̆blja̠,,,Il a une largeur double,,
43-VillarsleTerroir,VillarsleTerroir,l a̠ dro̞ːblʲa̠ lă̠rdʒa̠ːɔ͉,,,Il a une largeur double,,
43-LAuberson,LAuberson,ĕ̞l a̠ na̠ lă̠rdʒø̆ drɔ̆blʲa̠͉,,,Il a une largeur double,,
43-Miege,Miege,j ă̠ na̠ lă̠rd͉zjoːu͉r dɔ̆bla̠,,,Il a une largeur double,,
43-Semsalves,Semsalves,j a̠ drɔ̆bjă̠ lă̠rdʒja̠ː,,,Il a une largeur double,,
43-Saviese,Saviese,l a̠ dɔ̆bla̠ o̞͉a̠ːrdʒ̟jŭ,,,Il a une largeur double,,
43-Laconnex,Laconnex,l a̠ drɔ̆blʲɔ͉ lă̠rʒœːr,,,Il a une largeur double,,
43-Vaugondry,Vaugondry,l a̠ drɔ̆blʲa̠ lă̠rdʒøː,,,Il a une largeur double,,
43-Champery,Champery,l ă nă̠ lă̠rdʒœ̆ drø̞̆bða̠͉,,,Il a une largeur double,,
43-Orsieres,Orsieres,l ă̠ ɔ̃na̠ lă̠rdʒœː döbla͉,,,Il a une largeur double,,
43-ChateaudOex,ChateaudOex,ĭd ă̠ ŭnă̠ lă̠rdʒa̠͜o ˈdrɔ̆bða̠,,,Il a une largeur double,,
43-Hermance,Hermance,el e d dɔ̆blʲa̠͉ lă̠rðjø,,,Il a une largeur double,,
43-Collombey,Collombey,l a̠ na̠ la̠rdʒj͉ø̞ dro̞ːbða̠͉,,,Il a une largeur double,,
43-Conthey,Conthey,ă̠ ɔ̃na̠ ˈdrɔ̆bva̠ a̠ːrdʒj͉ø̆,,,Il a une largeur double,,
43-ChauxduMilieu,ChauxduMilieu,il ă̠ a̠na̠ lă̠ʁdʒy̆ k ɛ̆ ˈdy̆bja̠,,,Il a une largeur double,,
43-Evolene,Evolene,j ă̠ na̠ lă̠rʒjŏu͉k͉ dɔ̆bla̠,,,Il a une largeur double,,
43-AvrysurMatran,AvrysurMatran,l a̠ ˈdrɔ̆blʲa̠ lă̠rdʒa̠ː,,,Il a une largeur double,,
43-Arconciel,Arconciel,l a̠ na̠ drɔ̆bja̠ la̠rdʒj͉a̠ːɔ͉,,,Il a une largeur double,,
43-Collex,Collex,l a̠ nă̠ lă̠rʒø̆ dröblʲă̠,,,Il a une largeur double,,
43-Noiraigue,Noiraigue,ɛ̆l ă̠ drɔ̆bjă̠ lă̠rdʒœ̆,,,Il a une largeur double,,
43-Nendaz,Nendaz,ĭ ă̠ dɔ̆bla̠ a̠ːrdʒ̟jɞ̆u͉,,,Il a une largeur double,,
43-Boudry,Boudry,ɛ̆l a̠ ɛna̠ drøːbja̠͉ lă̠rdzœːr,,,Il a une largeur double,,
44-Martigny,Martigny,la̠ tʲøˈdœ̆ra̠ l ë dre̞i͉t,,,La couture est droite,,
44-Dompierre,Dompierre,la̠ kɔ̆ˈdura̠ l ɛ dra̠ːɛ͉t,,,La couture est droite,,
44-Charnex,Charnex,lă̠ kæ͉ˈodœ̆ră l ĕ̞ drɔ̆j͉tə͉,,,La couture est droite,,
44-Roche,Roche,lă̠ kɔ͉͜ø̞dœ̆ra̠ l ĕ̞ drɑːɛ͉te̞͉,,,La couture est droite,,
44-CerneuxPequignot,CerneuxPequignot,lɛ̆ kœ̆ˈty̆r ă̠ drɛ̆tɛ͉,,,La couture est droite,,
44-Savagnier,Savagnier,la̠ kɔ̆dɹ̩ ɛ tɔ̆t dreːt,,,La couture est droite,,
44-Longirod,Longirod,lă̠ ˈka̠͜oˈdəra̠ ɛ̆ dra̠͜eta̠͉,,,La couture est droite,,
44-Sugiez,Sugiez,la̠ ˈkɔˈdră̠ l ĕ̞ drɛːt,,,La couture est droite,,
44-Landeron,Landeron,la̠ kɔtur ɛ drɑ̝ːɛ͉t,,,La couture est droite,,
44-Arnex,Arnex,la̠ kɔ̆ˈdœːra̠ ɛ̆ dra̠ːɛ͉tə͉,,,La couture est droite,,
44-Vullierens,Vullierens,la̠ ˈkŭtə͉ra̠ ɛ drɑːɛ͉t,,,La couture est droite,,
44-Veyrier,Veyrier,la̠ køːdra̠͉ ɛ dra̠͉ɛːta̠͉,,,La couture est droite,,
44-OrmontDessus,OrmontDessus,la̠ ˈka̠͜ɔdră̠ ɛ̆ dra̠͉ɛːtə͉,,,La couture est droite,,
44-Montalchez,Montalchez,la̠ kɔ̆ˈdëʁa̠ ɛ̆ dʁa̠ː͜e͉ta̠͉,,,La couture est droite,,
44-Montpreveyres,Montpreveyres,la̠ ko̞ːduːra̠͉ l ɛ̆ dra̠ːɛ͉tə͉,,,La couture est droite,,
44-Lourtier,Lourtier,ə tʲø̞y͉dʏ̈ra̠͉ ɛ drăit,,,La couture est droite,,
44-Ayent,Ayent,lə kö͉udʉra̠ lʲ ɛ dre̞ite̞͉,,,La couture est droite,,
44-Cerlatez,Cerlatez,læ kŭˈty̆r a̠ː drwă̠t,,,La couture est droite,,
44-Corcelles,Corcelles,lă̠ kɔ̆ˈdy̆r ɛ dræːta̠,,,La couture est droite,,
44-Sombeval,Sombeval,la̠ kutyːr ɛ drɛt,,,La couture est droite,,
44-Vernier,Vernier,la̠ køːdə͉ra̠͉ z ɛ̆ dræːta̠͉,,,La couture est droite,,
44-StGingolph,StGingolph,la̠ kɐu͉dëra̠͉ ɛ̆ drɛ̆itə͉,,,La couture est droite,,
44-Prahins,Prahins,lă̠ kɔ̆ˈtuːra̠͉ l ɛ̆ dræːtə͉,,,La couture est droite,,
44-Plagne,Plagne,la̠ koːˈdy̆r ɛ drɑːɛt,,,La couture est droite,,
44-Commugny,Commugny,la̠ køːˈtəra̠ ɛ̆ dra̠͜e̞ta̠,,,La couture est droite,,
44-Grone,Grone,lɪ̈ kʊu͉dʊ̈ra̠ j ɛ̆ dre̞itə͉,,,La couture est droite,,
44-Courtepin,Courtepin,la̠ ˈkŭˈdŭra̠͉ l ɛ draːe̞͉tə͉,,,La couture est droite,,
44-LeSentier,LeSentier,lă̠ kɔ̆ˈduːră̠ ɛ̆ dră̠͜ɛ̆ta̠,,,La couture est droite,,
44-Vermes,Vermes,læ tʲøːtyːr ɑ̝ drwæt,,,La couture est droite,,
44-Murist,Murist,la̠ ˈkɔˈdëra̠ lʲ ɛ̆ drɑ̝ːtə͉,,,La couture est droite,,
44-CoteauxFees,CoteauxFees,lă̠ kɔ̆drœ̆ ɛ̆ drɛ̆ta̠,,,La couture est droite,,
44-Fully,Fully,la̠ tʲœʉ͉ˈdʏ̈ră̠ l ɛ dra̠itə͉,,,La couture est droite,,
44-Chevroux,Chevroux,la̠ kɔ̆ˈtœ̆rə͉ ĕ̞ drɑːtë͉,,,La couture est droite,,
44-Grimentz,Grimentz,lɪ̈ kŭg͉dŭra̠ lʲ ɛ drĭte͉,,,La couture est droite,,
44-Vallorbe,Vallorbe,la̠ ˈkŭtəˈră̠ ɛ̆ dræːta̠͉,,,La couture est droite,,
44-Montbovon,Montbovon,la̠ ˈkɔ̆dəra̠ lʲ ɛ dræːtə͉,,,La couture est droite,,
44-VillarsleTerroir,VillarsleTerroir,la̠ kw͉o̞ːduːra̠ ɛ̆ dra̠ɛ͉tə͉,,,La couture est droite,,
44-LAuberson,LAuberson,lă̠ kɔ̆tyːr ɛ̆ dre̞ːta̠͉,,,La couture est droite,,
44-Miege,Miege,le̝ kou͉dʊːra̠ j ɛ̆ drĭte̝͉,,,La couture est droite,,
44-Court,Court,la̠ tʲøːˈy̆r ɛ drɛːt,,,La couture est droite,,
44-Semsalves,Semsalves,la̠ ˈkɔ̆ˈdura̠ j ɛ dra̠ːtə͉,,,La couture est droite,,
44-Orvin,Orvin,la̠ koudyːr ɛ dræit,,,La couture est droite,,
44-Saviese,Saviese,ĭ ˈky̆dʊːră̠ l ë drĭtɛ͉,,,La couture est droite,,
44-Laconnex,Laconnex,lă̠ kœy͉drɑ̝ ɛ dră̠tɔ͉,,,La couture est droite,,
44-Vaugondry,Vaugondry,la̠ ˈkŏ̞ˈdɛ̆ˈra̠ ɛ dræːtɛ͉,,,La couture est droite,,
44-Champery,Champery,la̠ ˈtʲy̆ˈdëră̠ l ɛ drɑːɛ͉tə͉,,,La couture est droite,,
44-Orsieres,Orsieres,lă tʲɞ̆ʉ͉ˈdʉră̠ l ɛ dræit,,,La couture est droite,,
44-ChateaudOex,ChateaudOex,lă̠ ˈka̠͜odə͉ˈra̠ d ɛ̆ dra̠͜et,,,La couture est droite,,
44-Hermance,Hermance,la̠ kœ̆dră̠ ɛ drɛ̆ta̠͉,,,La couture est droite,,
44-Courtedoux,Courtedoux,læ tʲø̞ːtyr ɑː drwæt,,,La couture est droite,,
44-Collombey,Collombey,la̠ ˈkʲydə͉ra̠ l ɛ drɑːtə͉,,,La couture est droite,,
44-Conthey,Conthey,ă̠ ˈky̆duːra̠ ɛ̆ drɛitə͉,,,La couture est droite,,
44-ChauxduMilieu,ChauxduMilieu,la̠ ˈkɔ̆ˈdy̆ˈʁă̠ ɛ dʁɛ̆ta̠͉,,,La couture est droite,,
44-Evolene,Evolene,lɪ̈ kŏu͉dʉ̆ra̠ l ɛ dreig͉tə͉,,,La couture est droite,,
44-AvrysurMatran,AvrysurMatran,la̠ kɔ̆duːra̠ l ɛ dra̠ːɛ͉tə͉,,,La couture est droite,,
44-Arconciel,Arconciel,la̠ ˈkɔ̆də͉ˈra̠ l ɛ dræːtə͉,,,La couture est droite,,
44-Collex,Collex,la̠ ˈkøːˈdərːă̠ ɛ̆ drɛːta̠͉,,,La couture est droite,,
44-Noiraigue,Noiraigue,la̠ kɔ̆dœ̆r ɛ dræːt,,,La couture est droite,,
44-Nendaz,Nendaz,ĭ kɞ̆u͉dŭra̠ ɛ̆ drɛ̆iti͉,,,La couture est droite,,
44-Lamboing,Lamboing,la̠ kuˈdy̆r ɛ drɛ̆t,,,La couture est droite,,
44-Develier,Develier,læ tʲø̞ːˈty̆r ɑː drwăt,,,La couture est droite,,
44-Boudry,Boudry,lă̠ kɔ̆dœ̆r ɛ dra̠ːɛ͉t,,,La couture est droite,,
45-Martigny,Martigny,lə ˈtsa̠ˈrːë l ë lëvë,,,Le char est léger,,
45-Dompierre,Dompierre,lu tse̞ː l ɛ lɛrdzi,,,Le char est léger,,
45-Charnex,Charnex,lə tse̞ːr l ĕ̞ lĕdzĭ,,,Le char est léger,,
45-Roche,Roche,lə tsɛ̆rĕ̞ l ĕ̞ lɛ̆dzĭ,,,Le char est léger,,
45-CerneuxPequignot,CerneuxPequignot,lu tʃɛː a̠ lɛ̆dʒiːɛ͉,,,Le char est léger,,
45-Savagnier,Savagnier,lə tʃɛːr ɛ lɛ̆rdʒiːë͉,,,Le char est léger,,
45-Longirod,Longirod,lə tsɛːr͉ ɛ lĕ̞dzi,,,Le char est léger,,
45-Sugiez,Sugiez,lə tsɛːr l ĕ̞ lɛ̆rdzi,,,Le char est léger,,
45-Landeron,Landeron,lə tʃe̞ːr ɛ lɛrdʒiːə͉,,,Le char est léger,,
45-Arnex,Arnex,lɔ tse̞ː ɛ lɛ̆rdzi,,,Le char est léger,,
45-Vullierens,Vullierens,lɔ̆ tsɛː ɛ lɛ̆rdzi,,,Le char est léger,,
45-Veyrier,Veyrier,lə θă̠rɛ̆ z ɛ̆ lɛ̆ði,,,Le char est léger,,
45-OrmontDessus,OrmontDessus,lə tsɛ̆rĕ̞ ɛ̆ leːdʒʲi,,,Le char est léger,,
45-Montalchez,Montalchez,lɔ̆ tse̞ː ɛ̆ lɛ̆ʁdzi,,,Le char est léger,,
45-Montpreveyres,Montpreveyres,lŭ tsɛː l ɛ̆ lɛ̆rdzĭ,,,Le char est léger,,
45-Lourtier,Lourtier,ə tsă̠ˈʁë ë lëvë,,,Le char est léger,,
45-Ayent,Ayent,lë tsă̠rɛ̆t͉ lʲ ɛ lɛ͜ɛt,,,Le char est léger,,
45-Cerlatez,Cerlatez,lə tʃĕj͉ə͉ a̠ː lwă̠dʒiːɛ͉,,,Le char est léger,,
45-Corcelles,Corcelles,lə tʃe̞ːr͉ ɛ̆ lɛ̆rdʒĭ,,,Le char est léger,,
45-Sombeval,Sombeval,lə tʃɛːr ɛ lardʒiːë͉,,,Le char est léger,,
45-Vernier,Vernier,l θă̠rːɛ z ɛ̆ lɛ̆ði,,,Le char est léger,,
45-StGingolph,StGingolph,lə tsă̠rːɛ͉ ɛ̆ lɛ̆dzi,,,Le char est léger,,
45-Prahins,Prahins,lə tsɛː l ɛ̆ lɛ̆rdzɪː,,,Le char est léger,,
45-Plagne,Plagne,lə tʃɛːr ɛ la̠rdʒiːɛ͉,,,Le char est léger,,
45-Commugny,Commugny,lə tsɛːr ɛ lɛ̆ðiː,,,Le char est léger,,
45-Grone,Grone,lë tsă̠rɛ̆t j ɛ̆ lɛ̆vɛ̆t,,,Le char est léger,,
45-Courtepin,Courtepin,lu tsɛː l ɛ lɛ̆rdʒjɛ̆,,,Le char est léger,,
45-LeSentier,LeSentier,lŭ tsæː ɛ̆ lɛ̆dʒĕ,,,Le char est léger,,
45-Vermes,Vermes,əl tʃɛjɛ͉ ɑ̝ː la̠rdʒiːɛ͉,,,Le char est léger,,
45-Murist,Murist,lə tsĕ lʲ ɛ lɛ̆rdzi,,,Le char est léger,,
45-CoteauxFees,CoteauxFees,lŭ tsɛ ɛ̆ lɛ̆dziː,,,Le char est léger,,
45-Fully,Fully,lə tsă̠ˈʁë l ɛ lĕ̞vɛ̆,,,Le char est léger,,
45-Chevroux,Chevroux,lu tse̝ː ɛ lɛ̆rdzi,,,Le char est léger,,
45-Grimentz,Grimentz,lɪ̈ tsă̠rɛ̆t lʲ ɛ lɛ̆zjɛ̆,,,Le char est léger,,
45-Vallorbe,Vallorbe,lŭ tsɛː ɛ̆ lɛ̆dzĭ,,,Le char est léger,,
45-Montbovon,Montbovon,lə tsɛ lʲ ɛ lærdʒĕ,,,Le char est léger,,
45-VillarsleTerroir,VillarsleTerroir,lɔ tsɛː ɛ̆ læ̆rdzi,,,Le char est léger,,
45-LAuberson,LAuberson,lə tsɛːr ɛ̆ lɛ̆rdzi,,,Le char est léger,,
45-Miege,Miege,le̝ tsa̠rɛ̆t j ɛ̆ lɛ̆vɛ̆t,,,Le char est léger,,
45-Court,Court,lɔ tʃeːă̠ ɛ lă̠rdʒiː,,,Le char est léger,,
45-Semsalves,Semsalves,lə tsɛ j ɛ lɛrdʒjɛ,,,Le char est léger,,
45-Orvin,Orvin,lə tʃɛːr ɛ lærdʒiːə͉,,,Le char est léger,,
45-Saviese,Saviese,ĭ tsă̠rɛ̆ l ɛ ɔ͜ɛdʒʲɛ̆,,,Le char est léger,,
45-Laconnex,Laconnex,lə θa̠rɛ ɛ̆ lɛ̆ði,,,Le char est léger,,
45-Vaugondry,Vaugondry,lɔ tsɛː ɛ̆ lærdziː,,,Le char est léger,,
45-Champery,Champery,lə tsɛ̆rĕ l ɛ lɛ̆dʒĭ,,,Le char est léger,,
45-Orsieres,Orsieres,lə tsăˈrĕ l ɛ lɛ̆vĕ̞,,,Le char est léger,,
45-ChateaudOex,ChateaudOex,lɔ̆ tsɛːr͉ d ɛ̆ lɛ̆dʒĭ,,,Le char est léger,,
45-Hermance,Hermance,l ˈθɛːˈrɛ̆ ɛ̆ lɛ̆ðĭ,,,Le char est léger,,
45-Courtedoux,Courtedoux,lə tʃeːɛ͉ ɑː lwă̠dʒiːɛ͉,,,Le char est léger,,
45-Collombey,Collombey,lə ˈtsɛ̆rĕ l ĕ̞ lĕ̞dʒjĕ̞,,,Le char est léger,,
45-Conthey,Conthey,ɔ̆ tsĕ̞rːĕ̞ ɛ̆ lɛidʒjæ,,,Le char est léger,,
45-ChauxduMilieu,ChauxduMilieu,lə tʃh͉eː ɛ lɛ̆dʒiː,,,Le char est léger,,
45-Evolene,Evolene,lɪ̈ tsă̠rːɛ̆t j ɛ̆ lëvɛ̆t,,,Le char est léger,,
45-AvrysurMatran,AvrysurMatran,lu tsɛː l ɛ lɛ̆rdʒɛ̆,,,Le char est léger,,
45-Arconciel,Arconciel,lə tsæː l ɛ lærdʒjæː,,,Le char est léger,,
45-Collex,Collex,l θa̠rĕ̞ ɛ ˈlɛ̆ði,,,Le char est léger,,
45-Noiraigue,Noiraigue,lɔ̆ tʃa̠ːr ɛ̆ lɛ̆dʒĭ,,,Le char est léger,,
45-Nendaz,Nendaz,ĭ tsărːɛ̆ ɛ̆t ëvɛ̆,,,Le char est léger,,
45-Lamboing,Lamboing,lɛ tʃɛːr ɛ lɛ̆rdʒiːə͉,,,Le char est léger,,
45-Develier,Develier,əl tʃĕj͉ə͉ ɑː lă̠rdʒiː,,,Le char est léger,,
45-Boudry,Boudry,lə tsɛːr ɛ̆ lɛ̆rdzĭ,,,Le char est léger,,
46-Martigny,Martigny,la̠ tse̞ːna̠ lëˈvɛta̠,,,La chaîne (est) légère,,
46-Dompierre,Dompierre,la̠ tsɛ̃ĩ͉na̠ lɛ̆rdziːr,,,La chaîne (est) légère,,
46-Charnex,Charnex,lă̠ tsɔ̆ina̠ lĕdziːrə͉,,,La chaîne (est) légère,,
46-Roche,Roche,la̠ ˈtsɛ̃ːnă̠ lɛ̆dziːrɛ͉,,,La chaîne (est) légère,,
46-CerneuxPequignot,CerneuxPequignot,lɛ tʃã̠nɛ lɛ̆dʒiːr,,,La chaîne (est) légère,,
46-Savagnier,Savagnier,la̠ tʃæːn lɛ̆rdʒiə͉r,,,La chaîne (est) légère,,
46-Longirod,Longirod,la̠ tsɛːna̠͉ lɛ̆dziːr,,,La chaîne (est) légère,,
46-Sugiez,Sugiez,la̠ tsɛ̃ĩ͉na̠ lɛ̆rdziːrə͉,,,La chaîne (est) légère,,
46-Landeron,Landeron,la̠ tʃɑ̝ːɛ͉n lɛrdʒiːr,,,La chaîne (est) légère,,
46-Arnex,Arnex,la̠ tseːna̠ lɛ̆rdziːrə͉,,,La chaîne (est) légère,,
46-Vullierens,Vullierens,la̠ tsɛːna̠ lɛ̆rdziːr,,,La chaîne (est) légère,,
46-Veyrier,Veyrier,la̠ θã̠nă̠ lɛ̆ðiːr,,,La chaîne (est) légère,,
46-OrmontDessus,OrmontDessus,lă̠ tsa̠͜ɛna̠ leːdʒʲiːrə͉,,,La chaîne (est) légère,,
46-Montalchez,Montalchez,la̠ tseːnă̠ lɛ̆ʁdziːʁə͉,,,La chaîne (est) légère,,
46-Montpreveyres,Montpreveyres,lă̠ tsɛ̃ĩ͉na̠ lɛ̆rdziːrə͉,,,La chaîne (est) légère,,
46-Lourtier,Lourtier,ə tse̝ːna̠͉ lëˈvɛta̠,,,La chaîne (est) légère,,
46-Ayent,Ayent,lə tsɛ͋ĩ͉na̠ lɛ͜ɛta̠,,,La chaîne (est) légère,,
46-Cerlatez,Cerlatez,læ tʃɪ̃n lwă̠dʒiːə͉r,,,La chaîne (est) légère,,
46-Corcelles,Corcelles,la̠ tʃæːna̠ lɛ̆rdʒiːr,,,La chaîne (est) légère,,
46-Sombeval,Sombeval,la̠ tʃɛːn lardʒiːr,,,La chaîne (est) légère,,
46-Vernier,Vernier,la̠ θã̠na̠͉ lɛ̆ðiːrë͉,,,La chaîne (est) légère,,
46-StGingolph,StGingolph,la̠ tsɛ̃ːna̠ lɛ̆dziːrə͉,,,La chaîne (est) légère,,
46-Prahins,Prahins,lă̠ tsɛ̃ĩ͉na̠ lɛ̆rdzɪːrə͉,,,La chaîne (est) légère,,
46-Plagne,Plagne,la̠ tʃã̠ẽ̞ĩ͉n͉ la̠rdʒiːr,,,La chaîne (est) légère,,
46-Commugny,Commugny,la̠ ˈθã̠na̠ lɛ̆ðiːʁɛ͉,,,La chaîne (est) légère,,
46-Grone,Grone,lɪ̈ tsɛ̃ĩ͉nă̠ ˈlɛ̆ˈvɛ̆ta̠,,,La chaîne (est) légère,,
46-Courtepin,Courtepin,la̠ tsẽĩ͉na̠ lɛ̆rdziːrə͉,,,La chaîne (est) légère,,
46-LeSentier,LeSentier,lă̠ tsɛ̃ĩna̠ lɛ̆dʒeːirə͉,,,La chaîne (est) légère,,
46-Vermes,Vermes,læ tʃeːnə͉ la̠rdʒiːr,,,La chaîne (est) légère,,
46-Murist,Murist,la̠ tsɛ̃ĩ͉na̠ lɛ̆rdziːrə͉,,,La chaîne (est) légère,,
46-CoteauxFees,CoteauxFees,lă̠ tsæ̃na̠ lɛ̆dziːr,,,La chaîne (est) légère,,
46-Fully,Fully,lă̠ tseːnă̠ ˈlɛ̆ˈvëtă̠,,,La chaîne (est) légère,,
46-Chevroux,Chevroux,la̠ ˈtsɛ̃ĩ͉na̠ lɛ̆rdziːr,,,La chaîne (est) légère,,
46-Grimentz,Grimentz,lɪ̈ tsɛ̆ŋ͉na̠ lɛ̆zjɛ̆re͉,,,La chaîne (est) légère,,
46-Vallorbe,Vallorbe,lă̠ tseːnă̠ lɛ̆dziːrə͉,,,La chaîne (est) légère,,
46-Montbovon,Montbovon,la̠ tsæːna̠ lærdʒiːrə͉,,,La chaîne (est) légère,,
46-VillarsleTerroir,VillarsleTerroir,la̠ tsɛːna̠ læ̆rdziːrə͉,,,La chaîne (est) légère,,
46-LAuberson,LAuberson,lă̠ tseːna̠͉ lɛ̆rdziːrə͉,,,La chaîne (est) légère,,
46-Miege,Miege,le̝ tsɛ̃ŋ͉na̠ lɛ̆vɛ̆ta̠,,,La chaîne (est) légère,,
46-Court,Court,la̠ tʃẽ̞n lă̠rdʒiːr,,,La chaîne (est) légère,,
46-Semsalves,Semsalves,la̠ tsɛ̃na̠ lærdʒ̟irə͉,,,La chaîne (est) légère,,
46-Orvin,Orvin,la̠ tʃɛ̃n lærdʒiːə͉r,,,La chaîne (est) légère,,
46-Saviese,Saviese,ĭ tsɛ̃nːa̠ ɔ͜ɛdʒʲeːrɛ͉,,,La chaîne (est) légère,,
46-Laconnex,Laconnex,lă̠ θɛ̃nɔ͉ lɛðiːrə͉,,,La chaîne (est) légère,,
46-Vaugondry,Vaugondry,la̠ tseːna̠ lærdziːrɛ͉,,,La chaîne (est) légère,,
46-Champery,Champery,la̠ tsɛ̃na̠ lɛ̆dʒĭrə͉,,,La chaîne (est) légère,,
46-Orsieres,Orsieres,la̠ tseːnːa̠ lɛ̆ˈvɛ̆ta̠,,,La chaîne (est) légère,,
46-ChateaudOex,ChateaudOex,lă̠ tsa̠͜ena̠͉ lɛ̆dʒiːrə͉,,,La chaîne (est) légère,,
46-Hermance,Hermance,la̠ θã̠na̠͉ lɛ̆ðiːrɛ͉,,,La chaîne (est) légère,,
46-Courtedoux,Courtedoux,læ tʃe͋n lwă̠dʒiːr,,,La chaîne (est) légère,,
46-Collombey,Collombey,la̠ tsẽ̞ĩ͉na̠ lĕ̞dʒjɛːrə͉,,,La chaîne (est) légère,,
